Comment,Date,Subreddit
"Quoting /u/veganlobby_tldr_bot

This is the best tl;dr I could make, [original](https://www.kcci.com/article/clarion-iowa-poultry-farms-prepare-for-highly-contagious-bird-flu/39287242) reduced by 85%. (I'm a bot)

---

&gt; Iowa poultry farms prepare for highly-contagious bird flu.

&gt; Poultry farms in Iowa are watching closely, as the highly-contagious bird flu spreads across at least seven states on the east coast.

&gt; An avian flu outbreak in 2015 cost Iowa almost 8,500 jobs and more than $1 billion in economic activity, according to a study commissioned by the Iowa Farm Bureau Federation.

&gt; ""I mean, it's tough on them.""It's believed the virus is spread through migratory birds, which means Iowa could see cases later in the season.

&gt; It's believed the virus is spread through migratory birds, which means Iowa could see cases later in the season.

---

[Summary Source](https://smmry.com/https://www.kcci.com/article/clarion-iowa-poultry-farms-prepare-for-highly-contagious-bird-flu/39287242) | [**Source code**](https://github.com/ryanaugustynowicz/vl_tldr_bot) | Keywords: **Iowa, Farm, bird, mean, spread**",2022-03-01 21:27:22,iowa
"WHAT CONSERTVITIVE leadership looks like is BOEBERT, GREENE Hawley and GAETZ- They are rogue loose cannons protected by alt right TRUMP mobs.   This is your party GOP. IT is clear Kim is very misguided and clueless as to how her party looks some praising PUTIN like TRUMP their chose.  YES TRUMP and his Trump law breaking minions at KKK white Supremacy rallies speaking.   
THE IOWA GOP SOOD up and TOSSED the middle finger out like kids and reckless losers is who the IOWA delegation is.  Un censored this is what they stand for.   
What does the GOP platform, policy, TRUMP agenda stand for?  PUTIN as all roads were in fact leading to Putin and now look at their mess.  The capital riot, the no conceding, TRUMP chaos, and obstruction from McCarthy and Meadows is weakening America by design.  IT is more of the same TRUMP threats and action that are destroying AMERICA. The TRUMP and GOP lawlessness must end in sentencing top GOP officials that trash Americas system and democracy. .     
KIM blames good safety, expert opinions, and science on The Democrats as she praises a million dead is not enough as science , vaxx, mask helped save live and her science of doing nothing does not deserve praise but, condemnation.    HER IGNORING covid 19 like TRUMP is not science as she calls it.   THIS is her killing people in IOWA.  We see it KIM and it is not science.   
 She makes her case for TEXAS, Arizona, Florida and IOWA states leading the way to a wave of new states that were right ignoring covid, bird flu, unknown infections?    Them keeping schools open at any cost, refusing any safety precautions, no science /expertise needed  during VIRUS pandemics.  Parents should demand their kid go to school during a pandemic, bomb attacks, riots, deadly situations also?   Them the parents being ADULTS and their right above all to spread deadly disease with out interference from experts and professionals?    She is saying ,   THE SCHOOL BOARDS, Counties, States should bow to rogue unruly loud parent? SHE is describing mob rule and does not even realize it. THIS",2022-03-02 07:55:10,iowa
"THE IOWA GOP   STOOD  up for a standing ovation  and TOSSED the middle finger out like kids and reckless losers right on the legislative floor.  This is what they think of workers.   This  is who the IOWA delegation is.     
What does the GOP platform, policy, TRUMP agenda stand for?  PUTIN as all roads were in fact leading to Putin and now look at their mess.  The capital riot, the no conceding, TRUMP chaos, and obstruction from McCarthy and Meadows is weakening America by design.  IT is more of the same TRUMP threats and action that are destroying AMERICA. The TRUMP and GOP lawlessness must end in sentencing top GOP officials that trash Americas system and democracy. .     
KIM blames good safety, expert opinions, and science on The Democrats as she praises a million dead is not enough as science, vaxx, mask helped save live and her science of doing nothing does not deserve praise but, condemnation.    HER IGNORING covid 19 like TRUMP is not science as she calls it.   THIS is her killing people in IOWA.  We see it KIM and it is not science.   
 She makes her case for TEXAS, Arizona, Florida and IOWA states leading the way to a wave of new states that were right ignoring covid, bird flu, unknown infections?    Them keeping schools open at any cost, refusing any safety precautions, no science /expertise needed during VIRUS pandemics.  Parents should demand their kid go to school during a pandemic, bomb attacks, riots, deadly situations also?   Them the parents being ADULTS and their right above all to spread deadly disease with out interference from experts and professionals?      
 KIM REYNPLDS While   saying, Liberty, Freedoms and Parents need to be heard they should not take away the professional’s decision-making judgements.       
   THE SCHOOL BOARDS, Counties, States should bow to mobs of rogue unruly loud parent.   KIM was describing mob rule with her stating parents should only be the ones deciding school board rules.  IF this is the case parents, teachers, kids, should leave school for budget cuts and just STORMING the Iowa capital.   
  
 KIM while stating parents only should decide their kids’ education does not even realize she was advocating for mob rules.  THIS makes Kim’s legislative power meaningless?  MOBS rule not legislation and boards designed to lead.  School boards, states, counties should not lead or do their duty to protect kids? That is taking their role and duty away.",2022-03-02 11:49:51,iowa
"It kills the birds and jumps to pigs, then humans you know those times where a lot of people die from the flu. That's because bird flu jumps from pigs to humans and presents with antigens that the majority of the public do not have immunity to. You cook your meat, but novel flu strains will cook our population. And those nut jobs at the beginning of COVID saying the regular flu is deadlier than COVID we're right when we talk about bird flus that make the leap.

Also, they don't even have to make the leap directly. Influenza virus does this really cool thing in host tissues where they can recombine their genetic info with other strains of flu in those hosts so even if the bird flu strain does not make the jump, the proteins that make it scary can.

But the largest concern is that it kills birds. If birds die you.cant fucking cook them and eat them. As such, poultry producers are required to kill flocks that even a single bird tests positive in. That can be millions of birds in a flock. That means millions in losses for the company and, well. No chicken on the store shelves.

Cool, you cook your meat.",2022-03-03 22:44:55,iowa
"Rare cases it transmits to humans and causes death/serious illness. But the biggest thing is if it mutates/bad strain for the birds themselves. Bad strains can kill 90+% of all birds infected. Not a very good way to profit.

See [https://www.cdc.gov/flu/avianflu/avian-in-birds.htm](https://www.cdc.gov/flu/avianflu/avian-in-birds.htm).

So you will care when chicken price skyrockets because bird flu wasn't contained.",2022-03-03 23:13:59,iowa
"The issue is that influenza has 6-8 strands of RNA in each virion, so if you have human influenza and you're exposed to bird flu, it'll mix and match every possible combination of those strands and see if something sticks. Bird flu as it exists right now is a very rare occupational hazard, but it's exceptionally good at creating a severe pandemic virus. I'd be 1000x less worried about this if a general influenza vaccine saw wide adoption. The good news is that current human influenza isn't all that infectious so a moderately effective vaccine that protected against all current and adjacent-possible human strains would pretty quickly wipe it out even without a ton of uptake.",2022-03-04 00:18:02,iowa
Don't do a damn thing about it because FREEDOM! it's just a democrat hoax right? Or does this logic not transfer to bird flu?,2022-03-04 09:57:25,iowa
"Hey now, she was quite worried about people when all the meat packing plants said they didn't have enough showing up for work. But in all seriousness though, bird flu can get very bad quickly for poultry, easily start wiping out entire farms profits for the year.",2022-03-08 00:00:21,iowa
"I heard bird flu is really mild for most birds that get it, and we need to think about personal responsibility in this time as opposed to government control",2022-03-08 17:34:49,iowa
"So is the point here that the bird flu is not a danger or that Covid is more of a danger?  Bird Flu can have a 50%-60% mortality rate in humans depending on the strain. So... I mean, this shouldn't be taken lightly.",2022-03-09 08:37:08,iowa
Are you aware they're being forced to cull them due to the bird flu spreading around?,2022-04-25 06:45:36,iowa
The bird flu affects a lot more than chickens,2022-04-26 03:33:46,iowa
"This is an awful post about the bird flu and what's going on with it. It makes it seem like the chickens were burned alive. That's not true. 

Also carbon monoxide is very humane. The birds just go to sleep. They don't suffer. 

The have to burn the chickens after death to stop the spread. They virus can be spread from dead chickens. If another bird ate a carcus that had the flu, they could get the virus then pass it on to other birds. It's not just a chicken virus. It's effecting geese, ducks, pheasant etc. 

Also the difference between 2015 and now is that the virus started as highly pathogenic where as 2015 it started as low and moved to high during transmission. So the virus is very much worse now than before. This is probably why they suggested other jobs to workers. Trying to repopulate barns is difficult. You can't merge 2 flocks for fear one could have the virus. There's more biosecurity measures involved now. And trying to get pullets that are ready are expensive and take time. Sometimes months or even up to a year.

They also could have suggested other jobs if Rembrandt is remodeling barns. Egg facilities have to go to cage free systems. So if they decided they are going to remodel during the bird flu epidemic, they don't need laborers to manage birds. 

I hope people who read this article do more research on educational sites.",2022-04-28 09:35:40,iowa
"Also the USDA literally says what farmers have to do if they get the bird flu. So maybe write a letter to them instead of getting mad at the farmers. 

[USDA Documents ](https://www.aphis.usda.gov/aphis/ourfocus/animalhealth/animal-disease-information/avian/avian-influenza/hpai-home/hpai)",2022-04-28 12:51:24,iowa
"&gt;Cisco Foods Sales Consultant Albert Koumdakjian said food prices for chicken and eggs are high because of the bird flu.

Yeah its a South African company: [http://www.ciscos.co.za/](http://www.ciscos.co.za/) 

\\s",2022-05-05 12:53:53,iowa
"What's causing the food shortage? They mention birds flu, but I'm pretty sure the ribs at rib shack don't come from birds",2022-05-06 07:08:51,iowa
"Maybe try the petting zoo at Blank Park? I'm not sure if they have chickens there. Might be out of season for chicks. However, they may have access to birds off limits due to the bird flu. Parakeet feeding was closed when I was there a few weeks ago.",2022-07-18 21:09:44,iowa
"Side tangent.

My girlfriend spotted two incredible vanity plates in Iowa:

Egg

Bird Flu",2022-11-20 04:30:06,iowa
"Gotta watch out for that bird flu. But hey, when there is a disease that affects humans, we gotta shove all the kids back into school as soon as possible!",2022-11-23 15:49:01,iowa
"This is the more important part of the legislation, and the part they need to be leaning into harder:  


""When natural disasters like bird flu and extreme weather strike, industrial livestock operations incur huge losses. These losses are too often shouldered by contract farmers, rural communities, and government,” said Craig Watts, former contract poultry grower and field team operations director, Socially Responsible Agriculture Project. “It’s time we stop allowing multibillion-dollar corporations to externalize the cost of their high-risk operations. The Industrial Agriculture Accountability Act shifts the burden to where it belongs: the backs of Big Agribusiness.""  


Historically the smaller family farms were naturally more humane and more environmentally friendly, not in a hardcore environmentalist kind of way, but their operations were just naturally less destructive, and they fished the waterways and their kids drank from the wells. The problem is the big industrial operations, which need regulated, and the state legislature desperately needs to get off it's ass and look at taxing commercial operations whose owners don't live in the state or even the country at a higher rate to give local operations a better chance.",2022-11-23 18:47:02,iowa
It's insane how much prices have gone up. This bird flu epidemic is insane and I hope it comes to an end and the hen population rebounds soon.,2022-12-11 14:06:36,iowa
They duplicate fast about as fast as the bird flu,2022-12-11 15:06:30,iowa
"At Aldi today in West Des Moines was 3.89 I believe. Better then that but stuff way more then .69c that it was a couple years ago.

Blame factory farming and bird flu for the increases",2022-12-11 16:39:34,iowa
I know nothing about poultry farming. Why are egg prices through the roof right now but chicken meat hasn’t really changed in price through this bird flu thing?,2022-12-13 15:15:07,iowa
I agree! I LOVE EGGS. Thanx to the bird flu I will have to give up my eggs.,2022-12-20 22:32:28,iowa
"it's not necessarily the cold that is killing them, birds tend to be very resilient to the cold, it is more likely bird flu or some other disease",2022-12-27 09:38:00,iowa
There have been reports for weeks in my area of people finding dead birds. DNR says it's probably bird flu.,2022-12-27 09:58:13,iowa
I read the first note and thought “i need to help save birds somehow”.  Then “bird flu”… big nope.,2022-12-27 15:42:54,iowa
"I have been obsessed with the price of eggs for 2 years. They’ve been creeping up but no one seemed to notice until they had a big spike recently. At first, they blamed bird flu, but that was at least a year and a half ago, I don’t think it was ever the problem. Until a month or so ago when he got a job at a different company, my brother was an industrial robotics specialist at an egg packaging plant. He told me that the whole time the price has been creeping up they’ve had excess eggs that were going to waste. Idk, I have no theory on why they’ve been getting more expensive all this time, but I don’t think it’s bird flu.",2023-01-20 20:14:18,iowa
"You may definitely be onto something but bird flu was (is) still hitting Iowa pretty hard.  16 million chickens euthanize in 2022 more than double the next closest state. 

https://www.weareiowa.com/article/life/animals/iowa-bird-flu-cases-december-2022-department-of-agriculture/524-a4bc7a30-e263-4ab5-bfcc-5618f3861c47",2023-01-20 23:17:40,iowa
"Bird flu is a huge problem. They can have over 70% mortality, and a single Sparrow can take it from one coupe to the next. Then with millions of infected chickens you risk that one of them mutates just enough for the flu to make the jump to humans.

So it's 50% the flu, and 50% greed because the corporations know they can get away with raising prices.  https://www.google.com/amp/s/amp.cnn.com/cnn/2023/01/13/business/egg-prices-cal-maine-foods/index.html",2023-01-21 05:38:17,iowa
"1. you're mistaking the why. They do not want to set a timeline because then there is a burden for the patient to 'prove' that they fit the very narrow guidelines. We saw clearly with the Cox case how women are treated when their health is in danger. This doesn't mean they actually happen during those later weeks. Less than 1% of all abortions are late term. Women in general would not carry a fetus for 8 months just to abort. That doesnt make any sense and is why the vast majority of them happen early on.

2. Being impoverished and in danger is a valid reason to seek asylum, which again, you used to be able to do at any crossing. We helped create the system that left these nations impoverished. We profited from it. It's our responsibility to deal with this in a humane way. 

3. Biden isn't responsible for the inflation, and he isn't responsible for it going down now. Even the egg industry, which had a valid reason to raise prices due to bird flu, artificially inflated their prices. Every study i have read has admitted that corporate greed has contributed significantly to this pricing. Otherwise...how would you explain that many of these companies that have inflated their products have also posted record profits?

4. Are you a medical professional that has the credentials to decide that gender dysphoria, and by extension, transgenderism is a mental illness? Because the DSM is the authority on that and I doubt you even know what that is. Just because you are ignorant, doesn't mean something is wrong with them.

5. If reading comprehension is so important to you, then why havent you read the dsm?

 I have heard right wing morons suggest both types of war. The only ones that want us to fight each other are the elites. Only war hawks want to continue the military industrial complex",2024-01-12 13:59:36,iowa
"Brenna Bird flu.  Chuck is stressed what was done to buy off Rastetter to keep Pat Grassley's Iowa House seat is going to come out. We know about the Iowa Code 13.7 embezzlement at ISU Research Park to Belin McCormick for Rastetter/Vilsack who office there.  


This phone call from Prince Bonesaw's secretary to English professor Amy Walton at ISU isn't at all sus ... https://efile.fara.gov/docs/6749-Supplemental-Statement-20200630-1.pdf",2024-01-17 16:01:32,iowa
"This article was included in FERN's Ag Insider Quick Hits. You can read more here: [https://thefern.org/ag\_insider/todays-quick-hits-feb-14-2024/](https://thefern.org/ag_insider/todays-quick-hits-feb-14-2024/)

**No plan? It’s okay | Bill would allow feedlots to operate with unapproved manure plans**

An Iowa state Senate subcommittee advanced a bill that would allow feedlot owners to spread manure on fields even if they were waiting for state approval of their nutrient management plans or appealing a rejection. (Iowa Capital Dispatch)

**Bird flu death in Cambodia**

A nine-year-old boy has died of bird flu in northeastern Cambodia, and his 16-year-old brother has tested positive for the virus; it was the first avian influenza death in Cambodia this year. (Associated Press)

**Global pork slowdown forecast**

Early signs point to a contraction in the number of breeding sows kept in herds in key regions of the world, including China and the United States, and a slowdown in global pork production, said a Rabobank report. (Meat and Poultry)

**Ukrainian farmers favor oilseeds**

A farmer survey by the Ukrainian Agriculture Ministry found growers intend to expand plantings of oilseed crops, such as soybeans, by 11 percent this year and reduce corn area by 9 percent. (AgriCensus)",2024-02-14 11:34:30,iowa
"Bird flu in the TX cattle herds likely appeared in January. Think about that.  We didn't know for certain pasteurization of milk killed the virus until much later.  Farm workers were showing signs of conjunctivitis in Feb., but only 1 confirmed case....
Farm workers didn't want to risk immigration status (in TX) and dairy farmers didn't want to risk culling the herd.

Meanwhile, mask mandates are banned in at least 12 States,  tests to return to work/school is banned in a handful of others.  On a positive note, a vaccine has been isolated and mass production for 100m doses can be ready in 9-12 months. 

I'm trying to avoid doom thoughts, but it is difficult",2024-05-16 20:56:44,iowa
"I hear ya. Between bird flu and cwd, nature is out to get us. And that's before mentioning climate change and geopolitical stuff. On a positive note, it's beautiful outside!",2024-05-16 21:19:05,iowa
"Obviously, but they don't have to harm people in the process. The laziness and greed leads to shit like poisoned waterways and infected milk/meat. There needs to be far more oversight on farmers. They shouldn't get a free pass just because they make food. NOBODY should get a free pass for endangering people/the planet. Cooking meat from bird flu infected animals supposedly kills it, but now you're talking medium well, instead of medium rare. Medium well means shit steak that needs A1. 

On top of that, it wouldnt have even gotten to cows, had farmers fed their cows with feed that didn't literally include chicken shit. Farmers caused this issue.",2024-05-17 05:08:06,iowa
"Oh, I fully agree that the government isn't to be trusted, but it has nothing to do with the article. They're worried about their livelihoods at the cost of public health. This isn't some conspiracy bullshit about the government coming in and murdering a cult. It's so far off topic. I'm attacking you because in this instance, the government can't do right or wrong, if it isn't aware of an issue. This is 100% farmers risking people's lives because they don't want to deal with the hassle. You're not arguing in good faith, so I refuse to do so at all. 

Ruby ridge and Waco have fuck all to do with the topic at hand. If they would get their animals tested, the public would be safer. Nobody is going to come and murder a farmers family because of bird flu testing. You're arguing some bullshit that isn't relevant, and you can fuck off.",2024-05-17 05:54:38,iowa
"Yeah, don't you know? Biden controls the bird flu! He went there himself and coughed on all the chickens!",2024-05-29 00:07:56,iowa
"And for this, their god will punish them this week with a heart wave resembling hell.  Good riddance Iowans.  I do not want your corn or bird flu infected beef.",2024-06-12 23:23:46,iowa
"Don't forget that Reynolds' school mask mandate ban isn't just for COVID, it's for *any* disease. Not really an issue with the avian flu, but worth noting imo.",2022-03-08 00:10:16,iowa
"It depends on the pathogenicity of the virus. Most cases of avian flu are subclinical, but it's the High Pathogenicity Avian Influenza (HPAI) that can cause massive losses.",2022-03-08 20:02:36,iowa
"I had ""Influenza A"" just recently. Supposedly that's avian flu.",2022-03-27 17:25:55,iowa
"Avian flu is [rarely transmissable](https://www.cdc.gov/flu/avianflu/h5n1-human-infections.htm) unless you're in close contact with infected chickens. [""Influenza A"" seems to be used to describe both human and avian flu viruses](https://www.cdc.gov/flu/about/viruses/types.htm) but crossing over is not a normal thing.

The above is the result of my 5 minutes of research on the matter so don't assume I really know what I'm talking about.",2022-03-28 17:57:58,iowa
"There are three types of influenza - A,B, and C. C rarely infects humans and is pretty mild. Influenza A,B, and C are not specific to humans. Birds, pigs, dogs,cats etc. can be infected by an influenza virus. However, each type of influenza has many subtypes and they are only occasionally zoonotic (able to jump species). H1N1 and seasonal H3 are the most common subtypes of influenza A to infect humans and is most likely one of the flu strains you had. It is very unlikely you weee infected by an avian flu strain.",2022-03-28 18:15:52,iowa
"Actually recently at Hy-Vee this brand was the cheapest option available. It's weird, with the avian flu epidemic and associated egg shortages sometimes the fancy brown free range eggs are cheaper than regular old white eggs.",2023-01-20 09:59:25,iowa
"Iowa was where the bulk of the avian flu occurred. Those damned pigeons really do carry diseases, along with red-wing black birds, black birds, wrens, sparrows, etc.

Millions of laying hens throughout the nation have been culled in an attempt to stop the disease from spreading.

Of course, it does not take that long to replace laying hens since little chicks can be bred pretty fast into adult laying hens again.

If egg prices don't go down in a year, you will know that this was a premeditated conspiracy to keep prices high. Monopolizing egg production and distribution will do that. It allows a few big players in any one market sector to essentially control prices for maximum profits.

This is no different than the oil market jacking up gas prices and yet no one ran out of gas, there were no lines, there was no shortage of gas.

I remember 1973 and the Arab oil embargo. That was a real shortage of gas. Gas stations ran out. Gas lines went for a mile at gas stations that had gas. The economy shut down due to lack of supplies being transported.

This egg crisis is nothing compared to a real crisis. So prices should return to normal. But they won't. We know why. We just won't be able to do anything about it.",2023-01-21 01:55:01,iowa
