Comment,Date,Subreddit
"Fair, I'm just used to people getting immediately bent out of shape.  My apologies.

While I dislike geese that has no bearing on why I think they should be removed from cities.  I think their population is stable now and I think they should go and behave like geese.

No predators in any environment (even an unnatural one like a city) can create a bad situation.

I just think they are not behaving like geese and may end up being injured by this.

I think eventually there is an overpopulation problem.  Looking at how well they have rebounded and how quickly this is a guess on my part.  In a city / suburban setting and with a law prohibiting (generally although Iowa DNR has exceptions available to them) human intervention other than simple discouragement there can come a time where disease threatens the geese and possibly other species as well.  Should they for example become impacted by the avian flu it will be bad for their population - overall.  I guess I just don't like depending on disease to possibly become the only predator available.

Without a predator they should be removed from an environ or managed in a fashion more than they are currently.",2024-05-09 10:57:47,iowa
Avian flu is not transmissible through pasteurized milk. Testing is just to better understand the spread/prevalence.,2024-05-16 21:31:55,iowa
This year with that extra bouquet of avian flu.,2024-06-06 01:36:02,iowa
"Highly Pathogenic Avian Influenza seems to have infectivity number slightly above 2.

COVID-19, original virus, had an estimated infectivity number slightly above 2.

[https://pubmed.ncbi.nlm.nih.gov/18559127/](https://pubmed.ncbi.nlm.nih.gov/18559127/)

To the Governor’s credit, she did declare  COVID-19 emergency on March 17,  2020.",2022-03-08 19:21:53,iowa
"When H5N1 hits, which is 60% fatal, you bet your ass I'll be getting vaccinated. Goodluck to you!",2023-05-28 12:08:34,iowa
"Well, Ebola virus originated in bats, so I suppose the might become infected with H5N1.  Good point.

Bats are famous for being reservoirs for many viruses: [https://www.ncbi.nlm.nih.gov/pmc/articles/PMC8064322/](https://www.ncbi.nlm.nih.gov/pmc/articles/PMC8064322/)",2024-06-21 18:21:14,iowa
