Comment,Date,Subreddit
Why is this not in the news from Texas news sources?!? There has been almost nothing about bird flu in Texas news for several weeks. Definitely feels like something is being hidden. Why have we learned absolutely nothing from Covid?,2024-04-30 12:04:34,texas
"Oh great, now the AMERICAN TEXAS BIRD FLU will get us all. Thanks Texas.",2024-04-30 13:55:46,texas
"I'm sure its good but is it worth contracting bird flu over? 


The one thing I don't get about the raw milk crowd is that they still consume pasteurized products and milk. It's not like they aren't bying OJ from the stores or skipping on Blue Bell Ice-cream. ",2024-04-30 15:07:10,texas
"Not surprised at all. Bird flu has made human to human jumps in the past. I went to Indonesia back in 2006 as part of an epidemiology study (I was the engineer part of a public health review) and the public notion was that there was no human to human, but we were able to trace and document it. Whatever strain this is now seems to be able to make some interesting jumps. I heard it has already killed a dolphin. That is a first for me.",2024-04-30 15:07:18,texas
It seems like we at least learned not to talk about it from covid. I'm sure Texas doesn't want a bird flu outbreak making headlines because it'll be bad for business. Better tear gas some nonviolent protestors to keep the media attention away from this incipient public health crisis.,2024-04-30 15:27:03,texas
"Omg, have you been on tiktok or Instagram lately? Dumb ass tradwife culture is basically gonna give everyone in their family bird flu by accident.",2024-05-01 17:30:27,texas
"Yyyyeeeesssss, especially when the mortality rate of of bird flu raw milk is 54%.",2024-05-01 17:31:48,texas
Isn't bird flu in humans the one with like a 50% fatality rate,2024-05-04 10:21:21,texas
"There’s something weird going around in my small Texas town that makes people feel sick for anywhere 2-3 weeks, I caught it and whatever it is it’s SEVERE, kicks Covid in the ass in every way possible. Problem is people are just going for flu and Covid test, nothing comes back, we are all poor out here and don’t go to the hospital until it’s absolutely necessary.

Whatever I had at one point had me running a 103 degree fever and hallucinating bugs all over surfaces. Luckily Tylenol and Kratom were able to bring this down to a 101 reliably. Not saying I had bird flu but whatever it is fucked me up. It’s been over 3 weeks now and I still don’t feel like I have recovered. Over a month for someone I know that had it before me and they still feel dead and ran through. 

If it does turn out I had a bird flu. What the fuck? I’m just anxious right now",2024-05-04 18:22:15,texas
"You are right. Don't let them Vax you!!!! And tell all your gop friends, bird flu Vax Don't work!!!!",2024-05-05 22:24:53,texas
"Osterholm started a podcast during covid. He continues to cover that but also provided updates on other disease like bird flu. 

[https://www.cidrap.umn.edu/osterholm-update](https://www.cidrap.umn.edu/osterholm-update)

His last update was that this one is probably not a problem. There are anti-virals for it we could quickly tweak if this virus evolves to human to human spread. I don't remember if he mentioned the detail about pigs but I may have missed it.",2024-05-12 15:56:29,texas
OMG!!!!! We’re all going to die!!!!  Bird flu now…Squirrel virus next!!! Oh the huge manatee!!!,2024-05-12 16:22:12,texas
"I keep chickens, ( 6 to be exact), is there a chance of my birds contracting bird flu from wild birds?",2024-05-12 23:17:38,texas
"It won't be till these people have lost most of their property and future to biblical level climate events and plagues that they'll realize this identity based grand standing was a mirage and a sham to distract from much more worthwhile efforts on this Earth. 
(hell many of have died before the ruse was up to covid and bird flu raw milk)",2024-05-19 11:51:45,texas
"In early February, dairy farmers in the Texas Panhandle began to notice sick cattle. Nearly 60 days passed before veterinarians identified the culprit: a highly pathogenic strain of the bird flu virus, H5N1. Had it been detected sooner, the outbreak might have been swiftly contained. Now it has spread to at least eight other states, and it will be hard to eliminate. 

Why did it take so long to recognize the virus on high-tech farms in the world’s richest country? Because even though H5N1 has circulated for nearly three decades, its arrival in dairy cattle was most unexpected. Tests for contagious diseases known to whip through herds came up negative. Some farmers wondered if the illness was related to ash from wildfires devastating land to the east.

An early indication that something had gone awry on farms in northwestern Texas came from devices hitched to collars on dairy cows. Darren Turley, executive director of the Texas Association of Dairymen, describes them as “an advanced fitness tracker.” They collect a stream of data, such as a cow’s temperature, its milk quality, and the progress of its digestion — or, rather, rumination — within its four-chambered stomach. What farmers saw when they downloaded the data in February stopped them in their tracks. One moment a cow seemed perfectly fine, and then four hours later, rumination had halted. “Shortly after the stomach stops, you’d see a huge falloff in milk,” Turley said. “That is not normal.”

In hindsight, Turley wished he had made more of the migrating geese that congregate in the panhandle each winter and spring. Geese and other waterfowl have carried H5N1 around the globe. They withstand enormous loads of the virus without getting sick, passing it on to local species, like blackbirds, cowbirds, and grackles, that mix with migrating flocks. But with so many other issues facing dairy farmers, geese didn’t register. 

Sometime in March, viruses appear to have hitched a ride to other states as cows were moved between farms. The limited genomic data available links the outbreak in Texas directly to others in New Mexico, Kansas, Ohio, North Carolina, and South Dakota. However, the routes are imprecise because the USDA hasn’t attached dates and locations to data it releases.

Researchers don’t want to be caught off guard again by the shape-shifting H5N1 virus, and that will require keeping tabs on humans. Most, if not all, of about 900 people diagnosed with H5N1 infections worldwide since 2003 acquired it from animals, rather than from humans, Jeremy Farrar, chief scientist at the World Health Organization said. About half of those people died.

Occasional tests of sick farmworkers aren’t sufficient, he said. Ideally, a system is set up to encourage farmworkers, their communities, and health care workers to be tested whenever the virus hits farms nearby.",2024-05-23 16:20:29,texas
"We track all the bird flu data live

https://app.dotadda.io/teams/9f2abbf6-90d0-44c2-966c-2dfe332fc248/dots",2024-06-06 22:06:49,texas
Bird flu free  guaranteed,2024-06-16 22:13:08,texas
"With the current avian flu, the DNR is recommending people take down their bird feeders and bird baths to help prevent the spread of the disease.",2022-04-29 16:10:03,texas
I like how it takes five paragraphs to get to the very simple explanation of avian flu killing tens of millions of laying hens.,2023-01-10 16:24:47,texas
California has it worse because all eggs must be cage free for sale. Avian flu have hit cage free just as hard so the smaller supply of available eggs has doubled their prices if you can even find eggs.,2023-01-10 19:26:14,texas
"the hens didn’t all die from avian flu, they were culled",2023-01-10 20:02:18,texas
"Nothing in this respect. That doesn’t mean he’s a great governor, or the other two stooges Paxton and Patrick are doing the state any favors either. This issue was caused by one of the worse outbreaks of avian flu to hit. Meat chickens take four weeks where laying hens take 18 weeks to reach maturity. 

If infection starts they basically have to cull the entire flock and clean the hell out of the barns and anywhere both the animals and workers were so they can start over. Then it’s a minimum of 18 weeks before any eggs start getting produced again.",2023-01-11 08:01:54,texas
This guy didn't read it either.  It's because a wave of avian flu killed millions of hens this year,2023-01-11 14:07:31,texas
"""because millions of hens died from the avian flu this year""

\-someone who actually read the article",2023-01-11 14:07:59,texas
You should tell them it's because millions of hens died this year from the avian flu,2023-01-11 14:08:18,texas
Actual TL;DR: Avian flu killed million of hens this year,2023-01-11 14:08:45,texas
"Or even just raise their menu prices by 3%, but that would make them look bad. This is a way to increase prices without publicly printing it.

Imagine if a company started selling eggs at 50 cents a dozen tomorrow but then added a $5 avian flu surcharge while still advertising that they were selling eggs for 50 cents. 

I'd rather just pay increased prices on the menu knowing what I'm getting.",2023-01-13 14:17:05,texas
"Prices have been up since the supply chain issues following Covid, plus a bunch of other stuff, mass cow deaths from drought, avian flu gutting the egg supply, etc. I also think companies are milking it as an excuse to increase profits.",2023-03-23 07:07:43,texas
"Right, I was saying there’s no way that losing 0.18% of all dairy cows could cause prices to spike 10-20%.

The avian flu situation has led to the death of about 10% of the poultry population and affected 48 states, I wouldn’t really call that a small percentage.",2023-04-15 11:24:43,texas
"Sorry, but this is too coincidental. What's up with killing all the animals? Ireland killing thousands of cows...dairy cows here in US. Avian flu...someone is trying very hard to depopulize maybe by famine...""Letz zem eat zee bugz""-Klaus Schwab and Gates. 2 evil humans. Globalists.",2023-06-10 17:51:27,texas
"My information comes from numerous under oath testimonies to Senate and various judicial committee hearings. I don't watch the news, I watch YouTube broadcasts of the actual hearings. And Dr. Evil-esque (I like that term! He he)  has already testified that the avian flu will infect a large portion of the world animal population. And there are YouTube videos where hill gates himself is talking about the next epidemic with shocking specificity. This is Under oath testifying and searchable on YouTube. 
I will admit that with so much misinformation out there, it can be difficult to ascertain the truth but that's where I get my information.",2023-08-09 12:39:16,texas
Avian flu killed a lot of chickens.,2023-09-06 19:49:42,texas
"Texas cows dropping dead from avian flu and lack of water, and the Texas government hot on the track of making Trans kids the state enemy number one.

Texas government has some skewed priorities.",2024-03-28 14:48:59,texas
"The avian flu has been transmitted from chickens to people and then people to people before. Usually, this requires close contact for sustained periods of time for human transmission to another human. In the case of chicken to human, the human has to encounter the bodily fluids of the chicken.",2024-04-01 20:29:10,texas
Looking like the environmentalists may not need to discourage meat consumption. There won't be any. Avian flu threatens the chickens and contaminates the beef. Are hogs next? Farms and animal facilities are petrie dishes for new viruses and antibiotic resistant bacteria. The industry may kill itself. Don't think I'm happy about it. That's just the way things seem to be going.,2024-04-01 22:18:43,texas
"Newest report I heard this morning (Tuesday) on National Public Radio stated that a human working in Alabama with cows/cattle has Avian flu today.

That is Texas, Idaho, and now Deep South Alabama has the virus circulating to humans in the span of a week.

I always wonder post-COVID how many humans need to become sick and die before people believe this is a deadly and unknown virus mutation.

Scares the fire out of me.  I am a conservationist who leans heavy into global bird migrations - this is not news to be taken lightly.",2024-04-02 21:15:04,texas
Avian flu infected cattle + wildfire = nice try,2024-04-02 21:19:06,texas
Variants of avian flu are always around. It’s really nothing to worry about…until it is.,2024-04-03 19:46:32,texas
"Yes, we have these idiots seeping out of the pores of every Texas county ATM because this is what happens when you  deny even a basic education and mass indoctrinate superstition and conspiracy. 


We even have the village idiots here locally telling people everyone needs to drink raw milk because they think Biden is contaminating pasteurized milk with avian flu to stop cows from farting to reduce climate change. Like seriously these people are willing to endanger themselves, their loved ones  and everyone else over crap they just made up in their heads. 💀",2024-05-08 19:03:48,texas
"&gt;everyone needs to drink raw milk because they think Biden is contaminating pasteurized milk with avian flu to stop cows from farting to reduce climate change.

It's no ""JFK Jr. faked his death and is going to be 'resurrected' to run as Trump's VP"", but that's still a pretty batshit conspiracy theory.",2024-05-08 19:20:01,texas
"There absolutely is a chance they can get avian influenza from wild birds that may be infected.

That's not to say it's guaranteed or a very high risk, but having awareness and being prepared/taking precautions is good.

H5N1 is just a highly transmissible type of avian influenza, unfortunately (there are low transmissible and high transmissible types of avian flu), so the risk/chance is greater.

[This PDF from the USDA may be helpful!](https://www.aphis.usda.gov/sites/default/files/bro-protect-poultry-from-ai.pdf)",2024-05-12 23:36:03,texas
"Because of the near 100 % mortality in wild birds (largely passerines)  and commercial chicken and turkey flocks ,and potential virulency when it jumps to humans (aout 50% mortality) global monitoring of of H5N1  and its ""cousins"" has been a top priority since the late nineties.  H5N1 highly pathogenic avian flu is highly mutable and often described as ""the big one"" by virologists and epidemiologists. Covid is referred to as ""preparedness practice"" for a H5N1 human pandemic.  I feel relieved that many countries are alert, have been historically prepared or beginning to prepare. Many have stockpiled somewhat effective antivirals and prototype vaccines. The vaccine use ""old technology' and would require many months to ramp up production...that is a worry.  I hope we are working on new fast technology vaccines.  

  
What can we do? 

1.Pressure the FDA and related federal agencies  to ramp up monitoring and reporting of H5N1 in wild mammals (48 species to date have been affected), in commercial animal stock including dairy and beef cattle, and pigs and goats. Infections in pigs are especially concerning as we share similar genetic vulnerabilities"" to many pathogens.

3. Begin informing and educating the public, and listening to farmers. I have been impressed with local responses in the chicken and dairy industry. Farmers are very worried . They need the latest information as it emerges. But I worry that politics and money will carry more weight than public health. the FDA and associated federal agencies have their heads in the sand about this.  The public needs to be better informed and risks. 

4. Always be personally prepared for epidemics and pandemics. 

  
Where to go for information?  

1. I go to PubMed , where you can find all scientific papers and government documents from every country. But the papers are difficult going. Still if you want to try - do a search on avian flu in humans and limit it to the year 2023- 2024. I also go to the virology chat rooms. The science is pretty heavy but you can see the science reported without fear of government repercussions .. remember what happened to the chinese scientists and doctors who tried to warn about Covid in late 2019?

2. The WHO is more informative than the CDC.  

3. Media? Its tough to separate the fact from the fake.  As a biologist who teaches students to separate science fact from fake science the media source that is most scientifically/medically correct is the New York Times science section. ..not the editorials.  Many of the other media sources are loaded with disinformation.

4. Science News is an on line journal that takes the latest science and reviews it for the public. Its excellent.

5. I find it most useful to do a google search on : Avian Flu and set the date screen to most recent. Glance through the headings from scientific, academic and health sites to get a feel about the global and local impacts. Do look at new reports from our agricultural belts. See what our farmers and ranchers  are experiencing .

6. Avoid social media and conspiracy websites .. you want the cleanest, least politicized science and medicine  so you can make the most informed decision.

Faye",2024-05-13 10:21:28,texas
Because free standing ERs can bill at a higher rate. If you want to know what’s really going on start following the avian flu m.,2024-05-17 22:00:18,texas
"Yeah, when you have avian influenza in a flock, you unfortunately have to cull because it is highly infectious.",2023-01-10 20:53:29,texas
"Ummm, no.

In 1996, highly pathogenic avian influenza H5N1 virus is first identified in domestic waterfowl in Southern China.  [Source](https://www.cdc.gov/flu/avianflu/communication-resources/bird-flu-origin-infographic.html)


There are two reported cases of H5N1 infecting humans in the USA, one of those being an individual from Texas that was exposed to infected dairy cattle.  [Source](https://www.cdc.gov/media/releases/2024/p0401-avian-flu.html)

Do some research and stop spreading bullshit before someone brands you MAGA.",2024-05-13 06:44:17,texas
H5n1 mortality rate is over 50%. It will be vastly different than COVID most likely. ,2024-04-03 09:01:20,texas
"Eh, not necessarily. The rate you're stating is based on very, very, very iffy methodology because the areas where humans have been infected with H5n1 are areas where ~99% of people who aren't already at death's door aren't going to bother to get treated/tested. It may be higher that seasonal flue due to lack of historical immunity to that particular strain, but COVID is a different animal with how fast it mutates.",2024-04-03 12:58:19,texas
"Texan here. Texas has some of the best medical research and treatment facilities in the world. If you get sick and have insurance, Texas is a good place to be. 

On the other hand, Texas has some of the most ridiculous political/religious and cultural restrictions in the US. If you have a potential national health issue, you can take some horse de-wormer, join a prayer group and threaten doctors and researchers. 

Whatever didn't work for Covid 19 will continue to not work for H5N1.",2024-04-04 08:36:53,texas
"&gt; The first known case of a human contracting H5N1 from a mammal was recently reported in Texas, where a dairy farm worker suffered “very mild” symptoms including bleeding in the eyes due to the infection.",2024-05-04 09:48:03,texas
"Here is some info from the H5N1_AvianFlu reddit: 

https://www.reddit.com/r/H5N1_AvianFlu/s/wSBsQCcN8b",2024-05-04 20:01:31,texas
"I believe they worked on a dairy farm(I'm unsure of which one exactly) in the panhandle and contracted the virus there.

There have been several infected humans at this point, all from contact with infected cows and their bodily fluids, etc.

As of this moment, there is no recorded human to human transmission, and the virus would need to undergo the right mutations for that to happen.
But people can get sick from ingesting or improperly handling infected raw milk, raw cheese, or raw beef.

For what it's worth, the H5N1 virus is confirmed in a fairly large number of US dairy farms, not just in Texas. Something like ⅓ of all commercial milks in grocery stores are testing positive with the virus fragments, but pasteurization neutralizes it.",2024-05-05 20:00:03,texas
"You can check out the r/H5N1_AvianFlu subreddit which gets a lot of updates shared.

Some commenters are very level headed, some are bordering on prepping for a big outbreak, some are convinced the world will end and everyone will die.

As of right now, I don't think there's any significant risk of infection UNLESS you actively work in a dairy/cow farm, chicken/poultry farm, or interact regularly with animals that have been confirmed to be infected with the virus. Also, if you are actively avoiding handling and consuming raw OR undercooked beef, eggs, chicken, milk, cheese, etc, your risk is extremely low.

From my understanding, the virus has not reached human to human transmission. All confirmed human infections are from people who interacted with sick/infected animals/spaces.

The virus does need to go through certain mutations to be able to become human to human transmissible.

ONE of these mutations has been confirmed, but it needs to go through multiple mutations.

IF the virus is detected in pigs, these mutations become more likely and the risk becomes greater.

Other animals interacting with infected farm animals have fallen ill with quite severe symptoms and have died, including farm cats as well as a domestic NON farm cat, so the virus may be spreading to other cats outside of these farms.

Owners should keep their cats indoors, and also make sure their dogs don't try to lick/eat bird poop or raw/undercooked beef/eggs/dairy(if you feed your pet a raw/freeze dried diet, this is a legitimate concern).

The CDC has highly recommended farm workers wear appropriate PPE, but they essentially said the CDC can f•ck off and that they won't take extra necessary precautions.

But, as of right now, in this moment and stage of the virus, I wouldn't be too concerned if you're being careful about what you and your pets consume. Maybe also avoid spending time with any friends or family that actively work on at risk farms if you want to be extra extra extra cautious. This would be moreso due to if they have virus particles on their person from farm animal feces/fluids that you could pick up, not so much about any human to human transmission risk.

Additionally, the appropriate entities have stated that an adequate vaccine specifically for H5N1 could be created in a matter of weeks with an expedited rollout in the event that it does become human to human.

The greatest risk is in those early weeks/months before people can get vaccinated, so at the earliest confirmation of any human to human spread, just make some life changes and be extra careful(we all know how different people will handle this stage based on the Covid pandemic).",2024-05-12 15:13:32,texas
Yall... stop. Foreclosures and home prices won't be a thing if we had an outbreak of H5N1 across humans.,2024-05-12 15:35:18,texas
"We have h5n1 vaccines. The question is, how many.",2024-05-12 17:45:18,texas
"It is raging through farms but we don't know what the human version will look like: infectivity rate and a whole host of other factors. COVID was quite unique in its infectivity rate and the nature of its asymptomatic spread. In retrospect, it was impossible to contain.

Other outbreaks have occurred where the infectivity rate is low and you can only transmit when symptoms are showing. The diseases are still difficult to contain, but we do a much better job. Swine Flu raged a couple years ago.. it was bad, but nowhere near as bad as COVID.

With H5N1, we have some vaccines, therapeutics and tests. As I understand it, the Flu A tests works on H5N1. I am not saying that scientists have a handle on it, but they know a lot about this flu already. As I understand it, there are very few human cases.

It could take days or years for it to transfer to humans in a form that is more transmissible. No one knows.

The real worry is that meat and food prices in general will spike because of this outbreak on farms. In the past two years, the multinationals have been cutting production capabilities. So, the next hiccup in the supply chain means higher prices.",2024-05-12 19:02:05,texas
"Are vaccinated against COVID-19 ? 

If not, you're fucked. I say you're fucked because any vaccine to H5N1 will be a mRNA vaccine and if you refused the COVID-19 vaccines it's highly probable you'll refuse this new vaccine. 

If you are current on your vaccinations, you'll most likely be fine because you'll follow common sense measures like social distancing, masking up in public and limiting your travel.",2024-05-12 21:40:11,texas
