Comment,Date,Subreddit
Substantial bird flu outbreak in Iowa and now in Minnesota. Iowa has been dealing with it for several weeks with a big loss.,2022-03-28 08:43:34,minnesota
"Did they destroy the eggs, too? 

If so, we're way too scared of shit. The bird flu isn't passable to humans, so non-fertilized eggs are just not an issue. I could see the egg supply dropping over weeks, but not days.

There's something funny going on. Either Big Egg (there's Big Everything nowadays) decided to ""play it safe"" as a ploy to drive their profits, or the folks in Faribault/Owatonna went on a panic buy for eggs.",2022-03-28 12:12:48,minnesota
5 bucks for an 18 pack at cub in the north metro. Damn bird flu hitting hard this year.,2022-03-28 20:28:58,minnesota
Elk river walmart has been out for weeks now. Definitely bird flu combined with logistical challenges,2022-03-31 17:52:09,minnesota
They are likely suffering from this bird flu outbreak. You need to have them culled.,2022-04-01 00:55:00,minnesota
"Without reading into this, I assume that this farm euthanized a bunch of animals because bird flu infected the barn?",2022-04-13 11:15:16,minnesota
You are right. I have no moral issues with killing animals especially farm animals  which may spread bird flu.  I actually don’t care if you judge me.  I know I eat meat.  I know I should eat less( not for the sake of the animals but for health and environmental reasons) .  But killing animals for food in practical terms don’t bother me a bit.,2022-04-13 16:16:55,minnesota
"5 million birds?  For real?  That’s heartbreaking and a terrible waste, and the more I read about it I’m even more disgusted by both the farming practices and the bird flu’s impacts. But the protest?  Kinda hilarious.",2022-04-13 22:22:33,minnesota
"Yeah, not trying to give you a hard time. Just seemed like you were not sure why since you just bought the seed and they've been talking about the bird flu spread for some time now.

Store it in a cool, dry place it should be fine for next year.",2022-04-15 12:54:03,minnesota
"Don't know much about birds but as the beak looks to be curved that tends to mean raptor. I'd try calling the U of M raptor center if you're near St Paul. 

Could probably cross post to an ornithology subreddit see if they have ideas. 

The worry to me would be if it crashed cause it has bird flu.",2022-04-21 13:35:03,minnesota
Concerns with them and bird flu?,2022-04-24 17:38:09,minnesota
Kind of wondering this myself with the bird flu issue,2022-04-25 13:48:46,minnesota
You'll know it's bad when all the sea gulls at the Elk River transfer station (landfill) are gone. That's bird flu heaven and shitloads of seagulls flying around.,2022-05-09 08:38:24,minnesota
"Seconding the Indigo Bunting.

Here’s another pic of an Indigo Bunting with information of the current bird flu and request to not have bird feeders. (As far as I know this is still the recommended steps to take)

https://www.mprnews.org/amp/story/2022/04/15/u-expert-stop-backyard-bird-feeding-while-avian-flu-spreads",2022-05-09 14:49:58,minnesota
"There have been no cases I've read about the bird flu getting to song birds, the bigger problem seems to be big birds like ducks and geese  and that bird feeder doesn't really like it would be a problem",2022-05-09 15:33:14,minnesota
"No, I'm not arguing with some random guy on the internet about bird flu. All I'm saying is that MN DNR doesn't tell people to take them down. See the bottom in the question and answer section: https://www.dnr.state.mn.us/wildlifedisease/avian-influenza.html",2022-05-09 15:49:22,minnesota
"Large-scale poultry operations are responsible for the bird flu and similar viruses. 

I wag my finger at corporate agriculture and those enabling it.",2022-05-09 16:09:32,minnesota
Take down your bird feeders. Bird flu is killing a bunch of birds,2022-05-10 09:45:39,minnesota
Oh NO!!!  My friend found a dead songbird in her yard and had it tested.  Came back positive for Bird Flu. This is bad.,2022-05-14 09:55:16,minnesota
"bird flu, and the coyote population is probably going through a decline.",2022-07-13 11:37:27,minnesota
"Since the article has an annoying clickbait title (not OP’s fault). Here’s the answer:

“This year (2022) eagle occupancy and productivity numbers were down, with only 44 occupied nests and 32 nestlings found.  John Moriarty, Senior Manager of Wildlife for Three Rivers Park District who has flown these surveys every spring, suspects the decrease in numbers are due to this year’s incidence of bird flu combined with a cold spring.”",2022-07-26 17:51:21,minnesota
I'd agree but they don't even list any turkey sandwiches on their website for online ordering.   Check it out.    Apparently there is a turkey shortage because of Bird Flu so they cannot promise that product at all of their locations.,2022-08-09 22:21:12,minnesota
Bird Flu. https://tcbmag.com/bird-flu-means-new-reality-for-minnesota-turkey-farmers/,2022-11-23 16:26:28,minnesota
"Yes, but if we are the biggest producer of turkeys, shouldn't the bird flu affect pricing in surrounding states accordingly?",2022-11-23 17:07:16,minnesota
"idk, I guess the only acceptable answer is bird flu.",2022-11-23 17:35:11,minnesota
"A bird feeder alone will rarely attract many birds: there needs to be good habitat around your yard and trees or tall bushes near the feeder for the birds to hang out in. Did you lose trees recently, or was there a loss of larger habitat near your home? Did any neighbors recently start letting their cats out? Keep in mind that, sadly, bird flu also had an impact on songbird population this year.",2022-12-24 14:47:59,minnesota
"Totally. I'm sure the daycare is paying more for diapers, toilet paper, electricity, natural gas, and everything else they use. No different from all of us at home. Sadly, they have to pass those costs along.

I suppose their other option is cutting back on some of those things but my guess is most parents wouldn't like that. 

From June 2021 to June 2022, natural gas prices increased 165.5% across the US. ""We don't want to raise your daycare rates, but to save costs we're turning the thermostat down this winter and encourage you to dress your kids warm. We'll no longer be serving hot food.""

Most all of our own workplaces are doing the same. Businesses generally try to absorb some of it (I know my own company has) but at some point you do have to pass along at least some of that to the customers. I don't know of anyone who has had their boss come to them and say, ""We're paying more for all the resources we use, but we don't wanna pass that to the customer so we need to cut your pay by 10% in order to keep from having to impact customers.""

Much of it is likely because we don't always understand the reason behind the increases. When they're explained, most are accepting of it. I know with my own customers, they've been very understanding in that we've laid out how we've shouldered some of the cost increases to our own business but have had to pass along some of it (less than our competitors have passed along). At the same time, it's not as if you're going to walk into the grocery store and they'd have a sign explaining that eggs have gone up 49% in 2022 largely due to bird flu killing millions of chickens and farmers entering into price agreements for product they couldn't fulfill.",2023-01-03 17:06:56,minnesota
"avian bird flu hits the big boys way harder than smaller producers.  


cull 100,000 or 1,000 birds...  the poultry industry is still being ravaged by this disease",2023-01-14 18:46:49,minnesota
"Yes bc EE eggs used to be cheaper than cage free, but the Bird flu epidemic has fucked up the prices",2023-01-14 21:34:52,minnesota
Did Bird Flu write this comment,2023-01-15 00:36:04,minnesota
"The egg thing is quite literally supply and demand In action. You can thank bird flu for totally fucking over that industry. supply is in the shitter and will be until that gets under control. 

Also, where the fuck you paying over $4 for gas? I just filled up for $2.85 in North Minneapolis.",2023-01-19 00:54:30,minnesota
Benson has a plant that burns turkey shit. We may have lost a bunch of chickens and stuff to bird flu culling but we still have a lot if birds and they shit all the time. We could also use cow/pig/horse shit to fuel plants like that too. Would reduce the amount to spread in fields that ends up in our waterways too,2023-02-16 13:41:31,minnesota
"From CNBC article: 

""It may seem counterintuitive that egg and chicken prices moved in opposite directions.
The dynamic is primarily due to a severe outbreak of bird flu in the U.S. — which has killed many egg-laying hens but has largely left chickens raised for meat production unscathed, according to economists.

Chickens raised for meat consumption — known as ""broilers"" — aren't affected by avian flu to the same extent as the ""layers.""
""It's two totally different styles of production, two totally different breeds of bird,"" Moscogiuri said.
The life cycle of a broiler is much shorter — anywhere from 5.5 to 9 weeks, from hatch to slaughter, according to Vencomatic Group, a poultry consulting firm.

However, the life cycle for an egg-laying hen can be upwards of 100 weeks, Moscogiuri said. It can take about five to six months for layers just to reach full productivity, according to the Agriculture Department.
The latter are therefore more susceptible to bird flu since farmers must keep them alive for a longer time, experts said.
Broiler quantity is also up, contributing to lower chicken prices at the grocery store.""",2023-04-04 06:10:33,minnesota
That’s brilliant!  Fresh eggs without worrying about bird flu!  Where do I get one of those magic bunnies?,2023-04-14 11:00:14,minnesota
"I'm always curious - what's your solution for culling farmed birds where there's the 100% fatal, massively contagious bird flu?",2023-04-23 10:13:15,minnesota
"i'm not sure if this is still true, but i might take those down. as far as i know, there's a huge bird flu problem and people are advised not to keep out feeders, but i could be wrong",2023-05-11 02:13:31,minnesota
Let's hope we dodge more of the bird flu in our chicken and turkey farms.,2023-05-11 12:42:49,minnesota
"It's owned by Glen Taylor. Remember the story a few years ago about the chicken farm that dealt with bird flu by shutting off its ventilation system and letting millions of chickens suffocate to death? That was his farm.

Of course he promotes the attitude of ""Fuck you, I've got mine"" amongst his fellows in the owner-class.",2023-05-24 09:24:27,minnesota
"Eggs are WAY down.  Less than a dollar per dozen at ALDI.

People linking eggs to inflation were always dumb.  That was a bird flu issue.",2023-08-10 03:06:47,minnesota
"This article was included in FERN's Ag Insider Quick Hits. You can read more here: [https://thefern.org/ag\_insider/todays-quick-hits-october-12-2023/](https://thefern.org/ag_insider/todays-quick-hits-october-12-2023/)

**New pumpkin record | Gourd big or go home: Minnesotan grows world's largest pumpkin, breaks his own record**

For the second year in a row, Minnesota gardener Travis Gienger has grown the world’s largest pumpkin, this time a 2,749-pound monster that was 189 pounds heavier than last year’s winner at the World Championship Pumpkin Weigh-Off. (MPR News)

**Segregation and birds**

Across the Los Angeles Basin, bird species are “remarkably segregated” as a legacy of racial bias in home lending decades ago and modern wealth disparities, say researchers. (Los Angeles Times)

**EATS Act opponents**

Sixteen House Republicans signed a letter opposing the so-called EATS Act, which would overturn California’s Proposition 12 animal welfare regulations, citing, among other concerns, the act’s possible benefits to Chinese-owned Smithfield Foods. (Farm Progress)

**Gene editing takes on bird flu**

British researchers reported promising results when they used gene editing to protect chickens from highly pathogenic avian influenza, although it appeared that several genes must be altered to achieve immunity. (Center for Infectious Disease Research and Policy)",2023-10-12 11:17:06,minnesota
"https://apnews.com/article/bird-flu-avian-influenza-outbreak-virus-7b83ed4d76607bf874685e84b969ceae

https://apnews.com/article/disease-outbreaks-iowa-business-health-bird-flu-2c9ca4b3d04f3c0269a1fee233daa3a6

&gt;Bird flu last year cost U.S. poultry producers nearly 59 million birds across 47 states, including egg-laying chickens and turkeys and chickens raised for meat

""Inflation"" and profiteering aside, this is a big part of why chicken egg and meat prices have been high or inconsistent.",2023-10-19 18:16:16,minnesota
It feels inevitable that bird flu or whatever the next pandemic is will decimate this society. Imagine banning basic public health measures. We're setting ourselves up for failure. FFS.,2023-10-26 19:16:55,minnesota
"""Officials stress that bird flu isn’t a threat to food safety because all the birds on a farm where the disease is found are slaughtered before they reach the food supply, and properly cooking poultry and eggs to 165 degrees Fahrenheit will kill any viruses. Infections in humans are rare and usually come only in people with prolonged exposure to sick birds.""",2023-11-10 00:06:56,minnesota
"I'd like to know about symptoms, test used, efficacy, and accuracy to precision on the tests. 

Simply saying oh 1m had bird flu is a bunch of bullshit propaganda. There is no way in hell they tested all these birds lol.",2023-11-10 10:02:01,minnesota
Ferndale Market in Cannon Falls for turkey. They were among the only poultry farms to have zero issue with the bird flu due to how they raise and treat their birds.,2023-11-12 23:53:08,minnesota
"He has a couple of instances of some shady dealings, mostly revolving around businesses he was part of that employed family members. There is currently a lawsuit against him based on his dealings with a biotech company, Envoy, based in White Bear Lake. Granted, some of the people (Kevin McHale) who have brought the lawsuit aren't exactly bright shining examples of great ethics either. 

There was also a lawsuit in 2008 against one of his businesses for some sexual discrimination. I'm not sure where that went, but I found an article regarding the filing of the lawsuit. https://newscut.mprnews.org/2008/08/the_fall_of_glen_taylor/index.html

He did also get suspended by the NBA for 9 months back in 2000 for an illegal contract he gave player Joe Smith, in violation if the salary cap rules. 

Many are also upset about some of the poultry/egg facilities he owns that killed off tons of livestock when they were infected with the bird flu (perhaps you remember several activists trying to glue themselves to the floor during Timberwolves games a season or two back). I'm a little torn on that one though, as millions of birds had to be euthanized during that bird flu outbreak, all over the country/world.",2024-03-13 11:16:58,minnesota
"Well, now they are carriers of bird flu, so better safe than sorry",2024-03-26 08:28:07,minnesota
"That's why bird flu and pig flu are problems, but there's no fish flu. Norton are anti-virus.",2024-05-25 11:22:55,minnesota
"As reported by the [MN Department of Agriculture](https://www.mda.state.mn.us/business-dev-loans-grants/highly-pathogenic-avian-influenza-hpai-dairy-cattle), H5N1 ""Bird Flu"" was detected in sickened cows near Saint Cloud. This makes us the 11th state to detect a bird flu infection in cows.",2024-06-06 15:31:59,minnesota
"Naaaah, *That* one's Plague or Hanta Virus, *this* one's *bird* flu!


(/s, of course!😉)",2024-06-06 17:37:49,minnesota
Guess you aren’t afraid of the bird flu spreading to humans.,2024-06-06 18:20:34,minnesota
Yeah the bird flu has gotten into the diary cow herds so be wary about that.,2024-06-23 14:30:45,minnesota
"&gt;Highly pathogenic avian influenza has been confirmed in two poultry flocks in Minnesota, the state Board of Animal Health announced Saturday.

&gt;The agency said the affected poultry flocks are a commercial flock of nearly 300,000 turkeys in Meeker County, and a backyard flock of 17 chickens, ducks and geese in Mower County. Samples collected from both flocks were tested on March 25 and confirmed by the U.S. Department of Agriculture.

&gt;The state Board of Animal Health said they're the first confirmed cases in Minnesota in 2022.

&gt;Back in 2015, 9 million birds in Minnesota were killed by the virus, or euthanized to slow its spread. The virus is believed to be spread by migrating waterfowl in the spring.

&gt;Poultry producers in the state had been on high alert for weeks, and taking steps to increase biosecurity, after the virus was detected in neighboring states, including Iowa and South Dakota.

&gt;Officials cautioned that the appearance of avian flu in a backyard flock is a key difference from the 2015 outbreak.

&gt;""We are prepared to make sure this outbreak stays small,” said Dr. Jill Nezworski, a poultry veterinarian and a board member of the Minnesota Turkey Growers Association. “And I want to remind all poultry owners that biosecurity takes 100 percent commitment, 24 hours a day, seven days a week.""

&gt;State animal health officials have quarantined the two properties in Minnesota. All birds in those flocks will be destroyed and will not enter the food system, officials said.",2022-03-27 09:49:33,minnesota
I had a few friends snow goose hunting in ND this past weekend and they said they saw a number of geese that appeared to be sick with avian flu.,2022-03-30 10:49:12,minnesota
Both Forest lake and St. Croix falls have been out too. Walmart’s distributor flock had avian flu. They had to be destroyed. Egg and chickens will be a little harder to find for awhile,2022-04-01 09:57:27,minnesota
"Avian flu can transmit to cats. It's rare, but it can happen.",2022-04-14 18:37:48,minnesota
They look like a raptor of some kind?  Did it look like they were abandoned?  Sadly it sounds like this strain of avian flu is especially deadly to raptors (U of MN Raptor Center says 90-100% of infected raptors will die).,2022-04-16 20:08:54,minnesota
"I'd be careful with that because seed on the ground can attract rodents, which then might attract more raptors, which are very susceptible to avian flu. A congregation of birds at feeders or on the ground can also attract raptors.",2022-04-18 12:25:02,minnesota
"Fortunately the author of the blog I linked to in my post *is* an expert. And this isn't about placing blame. The virus is here, it's affecting wild birds, and people are trying to minimize the risk. The robins and cedar waxwings (neither of which are species that visit feeders) will move on because they've consumed all the berries in your tree. That's a very different situation from bird feeders, where we create an unnatural congregation of birds. And by  doing so, we need to take responsibility for that. Right now nobody knows for sure if these songbirds will be affected by avian flu, because there's no evidence of that so far. I'll take my feeders down if I have to, but I'm hoping with some adjustments, it won't be necessary.",2022-04-18 20:57:04,minnesota
Be very careful with this avian flu going around. Call your Raptor Center,2022-04-21 15:19:02,minnesota
"&gt;Be very careful with this avian flu going around.

Which brings me to my next point: DON'T LICK HAWKS.

Especially if it's Cooper's hawk. Cooper gets really jealous.",2022-04-21 16:25:47,minnesota
"Looks like a coopers, but hard to be sure in the light.  

As other comments have suggested contact the raptor center if it hasn't regained its wings yet.  

Beware avian flu. Not a significant threat to people, but if you have your own flocks of birds or hang feeders do safe practice.",2022-04-21 21:32:29,minnesota
Avian flu,2022-04-28 08:49:12,minnesota
"Virgina rail, looks like. It's spring migration so lots of tired birds around, plus avian flu could mean it's sick. Call the wildlife rehab center if it's not moving or acting like a normal bird.

I grabbed your pic and checked in my field guide and on Merlin (bird ID app). It's a Virginia Rail: https://imgur.com/amDDsPU",2022-05-05 11:49:38,minnesota
"Whatever type of bird you decide it is, if it's just sitting there out in the open and it lets you approach with a shovel, there's probably something wrong it. With avian flu spreading, the MN DNR / [Minnesota Board of Animal Health](https://www.bah.state.mn.us/hpai/) have set up a hotline to report this sort of thing. You should do that if it meets any of these criteria:

&gt;*Individual birds may exhibit the following signs of illness:*  
*Inability to fly*  
*Drooping head*  
*Swimming in circles*  
*Trouble standing upright*  
*Tremors*  
*Loss of coordination*  
&gt;  
&gt;  
*Other signs of HPAI include multiple dead birds in the same location and timeframe.*",2022-05-05 11:51:35,minnesota
"Police just called me back. Per the DNR (they’d sent an email to the police departments), they are no longer wanting potentially infected birds removed. They are to remain where they are and recommend civilians to not touch them.

He said that based on what I’d described, it is likely Avian Flu. They have had a few calls in Blaine.",2022-05-05 15:52:35,minnesota
I read something the other day that they think by the end of May the avian flu should be minor.,2022-05-08 10:25:54,minnesota
"I keep getting conflicting answers on this question. Some say yes, that avian flu doesn’t affect songbirds so it’s okay. However, some say songbirds are carriers who can infect the larger birds. I’d love to put out my feeders again, including hummingbird feeders. Still, I wait for a clear answer.",2022-05-08 10:27:48,minnesota
"https://raptor.umn.edu/about-us/our-research/HPAI

The raptor center is releasing weekly data on avian flu cases, which are still increasing.",2022-05-08 12:59:06,minnesota
Avian flu is fake news! Everyone knows birds aren't real and are a surveillance system for the government.,2022-05-08 16:30:32,minnesota
There's no demonstrated evidence of songbirds being greatly affected because there are no programs and no funding for testing songbirds for avian flu.,2022-05-09 08:19:41,minnesota
"April; they suggested taking them down to avoid spots where birds congregate closely to help reduce the rampant spread of Avian Flu. 

https://minnesota.cbslocal.com/2022/04/15/what-you-need-to-know-about-bird-feeders-and-bird-flu/

I was hoping I'd just missed an announcement that it was safe. My cardinal and finch friends have been peeping at me angrily every morning since I took mine down...",2022-05-09 17:05:30,minnesota
"The article you linked says the DNR does not have any record of songbirds carrying the avian flu, they never suggested feeders come down. The lady at the raptor center is understandably very upset about what she's encountering but she spoke outside of her area of expertise.",2022-05-09 20:17:30,minnesota
"Okay so I'm chiming in because somewhere else on the sub folks said the same thing. The head of the raptor center is a veterinary epidemiologist so it actually *is* her area of expertise. 

Song birds havent been confirmed to carry the avian flu but corvids can and youd be kind of dumb to think a crow isn't gonna hit up your feeder. 

Folks are recommended to consider things like: are there waterfowl (known carriers) in your area, are there raptors (known carriers) in your area, corvids? And then finally are there reports of avian flu in your area? If any of these things are true you are adding to the risk that the feeder is a place for it to spread around. 

Hummingbirds, while not known to be affected, do also congregate at sugar/nectar feeders and it may be advisable to hold off on this as well, though it seems mostly precautionary. 

I don't know where this shit about a fucking expert on avians talking out of pocket is coming from, but it needs to stop being repeated. The song birds are not going to die off because you hold off on feeding them for a season.",2022-05-10 10:34:14,minnesota
Avian flu?  Really?,2022-05-15 20:56:20,minnesota
"After finding an abandoned duckling on its back on the sidewalk I took her in after seeing the mother leave her as she couldn’t walk. After much research I learned she had a niacin deficiency. I made her a leg brace and fed her the appropriate supplements. She’s now finally running around and she’s the sweetest little thing! Well, being in a townhome in the burbs with two cats I am unable to keep her (no yard either)…. I’m devastated to give her up but she really needs a good home or farm. Every sanctuary or place I’ve spoken with has said they will not take in ducklings this year due to the avian flu and they would euthanize her. She doesn’t have the flu but I am distraught about where I can bring her now. Does anyone know of a place that would take a duckling? 
Also- I named him/her Sunny :)",2022-06-08 22:29:26,minnesota
"The avian flu is making things so hard this year. Not sure if you saw this but there is a list of rehabbers from the DNR.

https://files.dnr.state.mn.us/eco/nongame/rehabilitation/wildlife_rehabilitators.pdf",2022-06-08 23:10:14,minnesota
They aren’t taking ducklings due to avian flu :(,2022-06-09 10:41:53,minnesota
"Darn, that's too bad. I know avian flu is a bear this year.",2022-06-09 13:32:46,minnesota
The avian flu mixed in with this terrible heat has been a bad time for birds,2022-06-24 19:40:55,minnesota
5G.  Not Aliens or Avian flu.,2022-06-24 20:33:49,minnesota
