Comment,Date,Subreddit
"Iowa was where the bulk of the avian flu occurred. Those damned pigeons really do carry diseases, along with red-wing black birds, black birds, wrens, sparrows, etc.

Millions of laying hens throughout the nation have been culled in an attempt to stop the disease from spreading.

Of course, it does not take that long to replace laying hens since little chicks can be bred pretty fast into adult laying hens again.

If egg prices don't go down in a year, you will know that this was a premeditated conspiracy to keep prices high. Monopolizing egg production and distribution will do that. It allows a few big players in any one market sector to essentially control prices for maximum profits.

This is no different than the oil market jacking up gas prices and yet no one ran out of gas, there were no lines, there was no shortage of gas.

I remember 1973 and the Arab oil embargo. That was a real shortage of gas. Gas stations ran out. Gas lines went for a mile at gas stations that had gas. The economy shut down due to lack of supplies being transported.

This egg crisis is nothing compared to a real crisis. So prices should return to normal. But they won't. We know why. We just won't be able to do anything about it.",2023-01-21 01:55:01,iowa
"Fair, I'm just used to people getting immediately bent out of shape.  My apologies.

While I dislike geese that has no bearing on why I think they should be removed from cities.  I think their population is stable now and I think they should go and behave like geese.

No predators in any environment (even an unnatural one like a city) can create a bad situation.

I just think they are not behaving like geese and may end up being injured by this.

I think eventually there is an overpopulation problem.  Looking at how well they have rebounded and how quickly this is a guess on my part.  In a city / suburban setting and with a law prohibiting (generally although Iowa DNR has exceptions available to them) human intervention other than simple discouragement there can come a time where disease threatens the geese and possibly other species as well.  Should they for example become impacted by the avian flu it will be bad for their population - overall.  I guess I just don't like depending on disease to possibly become the only predator available.

Without a predator they should be removed from an environ or managed in a fashion more than they are currently.",2024-05-09 10:57:47,iowa
Avian flu is not transmissible through pasteurized milk. Testing is just to better understand the spread/prevalence.,2024-05-16 21:31:55,iowa
This year with that extra bouquet of avian flu.,2024-06-06 01:36:02,iowa
"Highly Pathogenic Avian Influenza seems to have infectivity number slightly above 2.

COVID-19, original virus, had an estimated infectivity number slightly above 2.

[https://pubmed.ncbi.nlm.nih.gov/18559127/](https://pubmed.ncbi.nlm.nih.gov/18559127/)

To the Governor’s credit, she did declare  COVID-19 emergency on March 17,  2020.",2022-03-08 19:21:53,iowa
"When H5N1 hits, which is 60% fatal, you bet your ass I'll be getting vaccinated. Goodluck to you!",2023-05-28 12:08:34,iowa
"Well, Ebola virus originated in bats, so I suppose the might become infected with H5N1.  Good point.

Bats are famous for being reservoirs for many viruses: [https://www.ncbi.nlm.nih.gov/pmc/articles/PMC8064322/](https://www.ncbi.nlm.nih.gov/pmc/articles/PMC8064322/)",2024-06-21 18:21:14,iowa
"God fucking damnit. COVID (which they said was just a little virus) is nearly over 2 years later And now we have the bird flu.   
well at least he’s in prison so the only infected people to spread to are criminals.",2022-04-28 23:56:56,colorado
Pandemic 2: Bird Flu Boogaloo,2022-04-29 09:57:42,colorado
"You may be drawing a conclusion that isn’t exactly there. I am not sure if you are insinuating that farm bird are dying from the bird flu in such numbers because they are weak farm birds. 

I mean healthy chickens give good eggs, and I’m all for that.

That said, the current bird flu appears to be moving through wild birds pretty quickly, which are pretty organic all things considered. 


Various state agencies are requiring mass slaughter of large amounts of chickens (millions) to try and slow or stop the outbreak from reaching wild birds so that it stops spreading. I mean it already has but that is a side point. 

Anyways “we” keep slaughtering millions of chickens that aren’t necessarily infected or otherwise affected. If testing shows an infection in a area generally all are killed quickly. “We” are slaughtering millions of chickens to attempt to stem the spread to wild birds and other industrial farming places. Often under orders by the state. 

Now you might make the argument that bird flu is more likely to start and gain significant foot hold due to factory farming. However it appears that once it gets out to wild birds, it’s still going to kill large amounts of them. So I’ll ask, which  robustness are you talking about? 


Also I think you may want to check back in a month to see if your organic eggs are still unaffected, I assume you meant price wise. If not LMK.",2023-01-10 20:29:34,colorado
If a pandemic happens within the next couple decades I have a terrible feeling the human response will be less energetic than it was for Covid. Atleast for general populations…unless it’s bird flu. Hard to call it a hoax when a third of the people you know are dying,2023-02-13 20:46:55,colorado
"You seem to be putting words in my mouth. 

I have no problem with the industry not knowing about prions in advance. That's understandable: feeding cows mammalian proteins didn't have a harm that we knew of in advance, I had no objection to them doing that. Once it became clear though that mad cow was a possibility, the industry had a right to argue ""nah, lets ignore it, I'm sure its fine, cheaper hamburgers!"" but obviously the rest of society should have and did say ""absolutely not, you need to take steps to prevent mad cow tainting the food supply even if it costs more.""

Using bedding from chickens (I gather that's what's going on here) we evidently know to be a liability for spreading bird flu and it needs to stop. I don't blame the industry for using it initially if they didn't know it could cause human deaths to make slightly more profit, that's to be expected from any industry, but now we need to force them to stop doing it and we're fools if we don't pass laws stopping it.

I also have no complaint about inefficiencies leading to higher costs. I know I'm in the minority here but I do NOT think that it should be ""as cheap as possible"" if that ignores externalized costs like breaking antibiotics, spreading disease, and making the climate permanently unstable.

Saving five dollars off hamburgers at those ignored costs is not worth it to me. I'd much rather the meat industry do it safely (for the rest of the world) or not at all.

Again, that's on us, not the industry, to regulate it. We as a society are idiots if we don't pass laws banning antibiotics, the use of any and all technology to limit GHG (from livestock industries and all other industries) and implement a carbon tax as appropriate to be able to counter the effects of GHG externalized costs.

The meat and dairy industries won't do it on their own, except token gestures to get us to forget about it and think the problem is solved so they can keep maximizing profit. That's again not a complaint or criticism of those industries specifically, that is just their nature. Industries and companies are not real people with consciences.",2024-04-28 11:06:56,colorado
"Animal agriculture is more protected and insulated from regulation than the oil and gas industry. They get insane amounts of subsidies to hide the true cost of meat and dairy. They're able to prevent scientists from testing animals for bird flu. They actively spray piss and shit onto people's property. They rely on migrant workers, including children, who endure amputations and arthritic inflammation. They greenwash their outsized environmental pollution impacts by falsifying data on claims such as regenerative farming. Their products are carcinogenic, cause diabetes and heart disease, yet do not need to inform consumers of the health risks of eating their preferred diet of meat and cheese 3x a day.",2024-05-29 09:41:03,colorado
"Generally speaking I am not a big fan of large agricultural animal operations, but with respect to the bird flu stuff, they have incentive to not want to test because the current way it's handled requires them to kill all the birds if any test positive, even if most of the birds aren't sick and/or would have survived, to prevent spreading. It's not necessarily the best approach, IMO. Something that could be revised and would probably help decrease the incentive not to report that kind of thing.

I just read in the paper today that more than 4 million chickens in Iowa are being killed after it was detected at an egg farm.",2024-05-29 13:37:34,colorado
"I like horses and all, but feral horses are literally an invasive and destructive species in North America. Every year, their population increases by 25%, or 
doubles every four years. I say we need to actually properly cull these horses, not keep them in pens where they give each other a deadly virus. 

I mean, in the last decade alone, we’ve seen the swine flu, avian flu, and the coronavirus (which originally came from bats, then in the middle of 2020 there was a mink scare in Europe). If we just let a virus mutate among thousands of feral horses in BLM pens, there’s a real possibility we’ll have the “equine flu” pandemic too. 

It’s irresponsible to just let these horses stay where they are. They need to be adopted out, and the rest need to be euthanized. Maybe we should allow hunters to take out feral horses in the same way they’re allowed to take out Eurasian Collard Doves and European Starlings. Sorry, but it’s the truth…",2022-04-27 03:02:25,colorado
"Is the avian flu an outbreak yet, or just a single case?",2022-04-30 13:19:49,colorado
"From the article:

&gt;In Colorado, there has been one case of an individual contracting avian flu from an infected bird. The case occurred in Delta County this April, when an individual came in direct contact with diseased poultry by doing culling at a commercial farm. The individual did not experience any severe symptoms, and there was no other transmission following this.

I would also note that a Google News search shows other articles about this subject and it looks like the issue is with birds. It's a disaster for agriculture due to how contagious and potentially fatal this is for birds.

However, it  does not appear to be a major issue with humans at this time--certainly not the next COVID-19, if that's what anyone has in mind.",2022-10-09 09:35:55,colorado
"Avian flu led to us baking around 5 mil (last I checked) chickens to death in the spring, which led to high egg and chicken prices.",2022-10-09 12:17:32,colorado
If you read the article it states that the water fowl migration helped exacerbate the avian flu in Colorado.,2023-01-09 20:15:34,colorado
"Key line:

&gt; no evidence so far of person-to-person transmission for the current avian influenza virus.",2022-04-29 02:08:27,colorado
"Merely tongue in cheek. Colorado is currently in the middle of an avian influenza AND an equine influenza outbreak (unrelated strains; avian is H5N1 and equine is H3N8).

We're all wiped out from COVID restrictions, but these hits keep coming and while these two outbreaks are mostly confined to animal populations, it's always ever a short genetic wiggle away from getting a foothold in the human population. Let's just say that these are the days you might consider donating a gift basket to your local epidemiologist.",2022-04-30 12:09:31,colorado
"Fuck paywalls

&gt;Raccoon kills eaglet in Front Range bald eagle nest that’s livestreamed via webcam
Eaglet that perished at Xcel Fort St. Vrain nest was six weeks old. A sibling eaglet survived, as did the parents.

&gt;A six-week-old eaglet was attacked by a raccoon and killed at Xcel Energy’s Fort St. Vrain facility near Platteville on Monday, Colorado Parks and Wildlife has confirmed.
The bald eagle family has a large following because two “eagle cams” are focused on the nest around the clock. Many follow the eagles via the Fort St. Vrain Eagle Cam Facebook group.
A second eaglet survived the attack, as did the mother and father. CPW said wildlife officer Mike Grooms responded to investigate 90 minutes after the attack.
“The camera showed a raccoon scaling to the top of the nest tree and grabbing the older, larger of the two eaglets from the nest around 7 p.m.,” the CPW statement said. “Wildlife officer Grooms was able to collect what remained from the carcass and delivered it to CPW’s Wildlife Health Lab, where officials will submit it for testing of Highly Pathogenic Avian Influenza.”
CPW noted that the nest dates back to 1993 and the camera went online in 2003.
“What followers saw on Monday was a natural event,” the statement said. “Predation of eaglets is not something you often hear about. Without a webcam, such events are hard to document. The vast majority of nest failures in Colorado are attributed to weather events (such as windstorms that damage or destroy nests or nest trees), new nests/inexperienced pairs, the loss of an adult during the nesting season and potentially human-related disturbance in the immediate area.
“The most likely mammalian predator of bald eagles in Colorado’s Front Range are raccoons, while avian predators include magpies, crows and ravens, hawks and owls.”
Many fans of the Fort St. Vrain eagles have commented on the Facebook group page, expressing their sadness over the incident. The group has more than 4,000 members.",2022-06-01 15:49:54,colorado
"This is nothing major. H5N1 is already known to be transmissible between birds and humans. It has been for awhile now, it’s nothing new.

Now, if H5N1 evolved to be transmissible between humans?… that would be the article you should be afraid of.",2022-04-29 08:48:27,colorado
"First, the article says H5N1 isn't transmissible to humans. Not the same as H1N1 (swine flu) that was going around in 2009.

Second...you know there are other people in prisons besides criminals, right? Like, you know, staff?",2022-04-29 10:13:28,colorado
"I hate to be that guy, but you’re really supposed to take down your bird feeders currently because of bird flu at the moment. Although, I’ve got a feeling that these folks might think bird flu is a Covid-type hoax.",2022-05-22 01:00:38,wisconsin
"Are we supposed to be feeding birds? I know there was a warning to take down feeders because of the bird flu. Is that not an issue anymore?

I haven't filled my feeders since last year because of the bird flu.",2022-05-22 11:56:43,wisconsin
"Your feeling is wrong, they aren’t covid deniers at all and they’re not bird flu deniers. Everyone around here has feeders out. The feeders aren’t out there because they don’t believe in avian flu, I just think it’s not common knowledge to not have a feeder out. I hadn’t heard that before now and was actually planning to go get my first real one next weekend to set up when I’m working on my yard.",2022-05-22 12:00:04,wisconsin
"Yeah I heard the same thing.  This morning I actually heard that if you find dead birds on your property with no clear cause you're supposed to report them to the DNR so they can test whether it was bird flu.  So as far as I knew it's still an issue.  I haven't been feeding or filling my birdbath, either...",2022-05-22 15:57:11,wisconsin
AFAIK the bird flu is still spreading. Bird feeders can become a hub for that infection,2022-05-22 17:52:49,wisconsin
Bird flu spreads at feeding stations. Don’t feed the birds.,2022-05-22 22:02:07,wisconsin
"https://dnr.wisconsin.gov/topic/WildlifeHabitat/disease.html

WI DNR is saying that you can leave your birdfeeders out bc this bird flu is not affecting songbirds. :)",2022-05-22 22:30:47,wisconsin
Im kidding i have 50+ illegally owned chickens all infected H1N1 bird flu if they spread it we will all die.,2022-11-28 14:45:32,wisconsin
"How asinine. It’s called bird flu, entire flocks were destroyed.",2022-12-27 18:01:07,wisconsin
I think what he is trying to say is that Biden invented bird flu.,2022-12-27 18:49:53,wisconsin
"Wife mentioned today eggs were around $6 for regular brands.  Looked it up and singe spring waves of bird flu have been going through wgg laying populations and those are driving up prices (along with increased fees costs and increased energy/fuel costs, and increased demand for more profits, etc).

Organics are competitive right now, but people will eventually notice the cost difference and increased demand will drive those prices up also.",2022-12-27 22:20:52,wisconsin
Got 24 at Costco in Pleasant Prairie for much less. That bird flu is no joke. It’s not inflation doing this.,2022-12-28 13:12:33,wisconsin
"It makes some sense when you think about the reason for the price increase.

It's the caged birds that are a breeding ground for viruses, and they were worst impacted by this strain of bird flu.

For your pasture raised hens, it's just business as usual.",2023-02-10 16:20:49,wisconsin
"I wouldn’t mess with them to much.  Bird flu is taking its toll on wild birds.

They’ll be fine, or they won’t.  Not much you can do about it",2023-03-01 09:05:39,wisconsin
"Interesting.  Thanks. We hunt in Catawba so stop in Medford otw up.  Always heard about the mink but thought it was just a running joke.


Was gonna say I thought I recalled  them culling a year or two ago. Just looked up mink again and they’re culling more due to bird flu.",2023-08-03 00:35:03,wisconsin
"Carbon dioxide will not make the meat inedible. 

Some has been sent to UW labs to see if it is suitable for distribution to area shelters.

The possibility of avian bird flu makes it too risky to feed raw to area zoos or wildlife rehab faculties",2023-08-15 09:47:27,wisconsin
"We aren't anti science. I've been receiving news about it since mid March when it was unknown what was the cause of disease was. The bird flu has a high morbidity but a low mortality. Causing low milk production in 2+lactation cows. The milk was thick and abnormal without a high high somatic cell count(SCC). A high SCC would indicate an infection.
There are no quarantines  between states because it's being passed by migratory birds.",2024-04-05 03:03:44,wisconsin
"[Wisconsin](https://www.aphis.usda.gov/livestock-poultry-disease/avian/avian-influenza/hpai-detections/mammals) has had bird flu found in red foxes,  a fisher, bobcat, and a North American River otter.",2024-04-05 11:50:21,wisconsin
"Controlling goose population during the bird flu pandemic seems reasonable.  My dog just nearly died of bird flu from eating goose poop at an urban park.  

Are you one of those prolife people?",2024-04-16 21:41:37,wisconsin
"There's a bird flu pandemic?  Never heard of it.  Pretty sure,  you just shouldn't let your dog eat bird shit, but im not tryin to tell you how to walk your dog",2024-04-16 21:44:41,wisconsin
"google bird flu pandemic Wisconsin 2024, and I guess there really hasn't been any issue for the last 6 years....",2024-04-16 21:48:57,wisconsin
"The bird flu didn't start in wild birds. It came from domestic chickens in crowded factory farm environments. Putting an end to animal agriculture is the only way to stop the spread of bird flu. If you're looking for someone to blame, think about who's actually responsible for the virus. I hope you're not supporting animal agriculture after this incident.",2024-04-17 10:13:04,wisconsin
"Just think, and they are feeding them CHICKEN WASTE....here comes the bird flu!!!!",2024-04-23 17:48:51,wisconsin
"This is a crime to animals, earth and humans. Greed, greed. 
It is happening here in Washington County near wetlands.
 Poor cows, what a life. Bird flu may take care of this. Nature has her ways.",2024-04-23 21:15:51,wisconsin
"Bird flu has now infected dairy herds.  Bird flu has been transmitted to at least one worker on a dairy farm.  World wide more than 800 people are known to have contracted bird flu, the fatality rate for humans infected with bird flu is 52%.
The CDC is urging that people not drink unpasteurized milk, that veterinarians and people working in meat packing plants wear full protective clothing including goggles when coming in contact with the bodily fluids of cattle.  There are real health concerns about CAFO’s under normal circumstances, and even more urgent concerns with bird flu. I recently learned that farms are permitted to feed the straw used for laying hens to cattle, one potential method of transmission to dairy cattle.",2024-05-04 20:34:31,wisconsin
"I still would; I don't see how the existence of bird feeders would affect their behavior in a significant way. If they contract symptomatic avian flu, they contract it. There's not much you can do about that.",2022-04-12 15:08:33,wisconsin
The Illinois DNR has asked everyone to put away their bird feeders and baths. Avian flu has been detected in Wisconsin too. Make sure to clean your feeders weekly.,2022-04-24 22:46:46,wisconsin
"**Update:** The link I found below is no longer active, but here is a link to a blog post from Madison Audubon regarding Avian Flu, bird feeders and other precautions you can take to prevent the spread.

[https://madisonaudubon.org/blog/2022/avian-influenza-in-wisconsin](https://madisonaudubon.org/blog/2022/avian-influenza-in-wisconsin)",2022-05-06 12:42:53,wisconsin
Avian flu still periodically wiping out chicken farms in waves around the country. Even one infected bird means the whole flock has to be culled because it's so infectious.,2022-12-02 12:12:54,wisconsin
"Organic eggs are surprisingly cheap right now. Avian flu &amp; increased feed prices, paired with the continued demand increased the price of standard eggs astronomically. These hasn’t impacted organic or free range as much. Once standard eggs meet the price of organic, you’ll see organic jump up too.",2022-12-27 18:50:24,wisconsin
"The largest part of the price increase in eggs is this - 

https://www.foodsafetynews.com/2022/12/avian-flu-this-year-results-in-record-bird-kills-raising-consumer-prices-for-eggs-and-poultry/

""This year’s deadly avian flu outbreak has busted through all previous records, killing so many birds that shortages are contributing to egg and poultry price increases for U.S. consumers who are already plagued by food inflation not seen in 40 years.

Here’s the situation report:

The highly pathogenic, highly contagious avian flu has led to the deaths of 52.7 million birds between February and December. That exceeds the previous record of 50 million during 2014-15.""",2022-12-28 05:55:09,wisconsin
Apparently there is avian flu going around that is restricting the supply of eggs. That's probably why the price is astronomical.,2022-12-28 06:28:43,wisconsin
"So you’re not using planedemic to refer to covid then but the avian flu? Because that’s the only use I’ve heard of that word.

It did just hit me really how much the prices can change and how quickly. Two weeks ago when I got groceries I paid 6.83 for a carton of 18 and this morning when I placed my order the same eggs were 4.23. I know they can manipulate prices but that seems like a massive change for such a short period of time.",2023-02-10 08:21:26,wisconsin
"That one to be fair is a product of the avian flu that hit the Americas. I live in England and I can still get half a dozen eggs for about $1.75 at my local store. Eggs may be the one thing we *don't* have crazy inflation on here yet, so it's interesting to see how bad it is in North America this year on that.",2023-02-10 16:33:59,wisconsin
"Over 52 million birds have died as a result of the most recent avian influenza outbreak in the US. In Iowa, two massive egg-laying operations had to cull more than 5 million birds in single incidents earlier this year. Combine that with the winter storm supply chain impacts, and you have huge price increases not related to inflation. 

Edit to add: increased egg prices do drive inflation though. 

https://www.npr.org/2022/12/02/1140076426/what-we-know-about-the-deadliest-u-s-bird-flu-outbreak-in-history",2022-12-27 18:27:56,wisconsin
"*“Although avian influenza viruses, first detected in humans in 1997, have caused outbreaks that killed hundreds of people, they have difficulty infecting human cells because of differences in the sugars that adorn human and bird cellular receptors for the virus. But humans have the bird version in our eyes, which explains why we can develop conjunctivitis.”*

Okay this is pretty cool everyone we got bird sugars",2024-04-04 16:32:50,wisconsin
"MASK UP!

If the bird flu won't kill you, the murder hornets in a few months will.",2022-02-25 16:04:43,michigan
