Comment,Date,Subreddit
And h5n1 in the mid 90s,2024-06-07 04:15:28,minnesota
City guy here. Does the bird flu render the chicken inedible?,2022-12-19 19:57:05,southdakota
The bird flu has hit the dairy industry in several states recently.,2024-06-29 13:59:59,southdakota
"This is the best tl;dr I could make, [original](https://listen.sdpb.org/business-economics/2022-03-18/85-000-birds-euthanized-as-south-dakota-sees-first-avian-flu-outbreak-since-2015) reduced by 90%. (I'm a bot)
*****
&gt; State officials say 85,000 birds at two South Dakota facilities have been euthanized as the state tackles its first avian flu outbreak since 2015.

&gt; Miller said the South Dakota birds might have contracted the avian flu from these wild birds.

&gt; Miller said farmers that have to kill their birds can receive financial compensation from the USDA. He said birds can pass the disease to humans, but that hasn&amp;#039;t happened this year and didn&amp;#039;t happen in 2015 within South Dakota.


*****
[**Extended Summary**](http://np.reddit.com/r/autotldr/comments/tj5ppu/85000_birds_euthanized_as_south_dakota_sees_first/) | [FAQ](http://np.reddit.com/r/autotldr/comments/31b9fm/faq_autotldr_bot/ ""Version 2.02, ~635125 tl;drs so far."") | [Feedback](http://np.reddit.com/message/compose?to=%23autotldr ""PM's and comments are monitored, constructive feedback is welcome."") | *Top* *keywords*: **bird**^#1 **Miller**^#2 **avian**^#3 **South**^#4 **State**^#5",2022-03-21 03:01:04,southdakota
"Add in some H5N1 avian flu and the next few years are going to be rather interesting 

https://www.reddit.com/r/H5N1_AvianFlu/s/SlYCA5zP0K",2024-06-06 15:48:51,southdakota
"Well, unfortunately, avian flu is getting crazy so I understand the concern. If it keeps happening near you, you could tell Game Fish and Parks",2024-06-29 22:23:35,southdakota
Could be [2022 Bird Flu](https://www.foodsafetynews.com/2022/06/after-40-million-dead-birds-hot-weather-may-be-killing-off-the-bird-flu-virus/),2022-06-20 01:23:57,california
Is there any year where bird flu doesn’t infect bunch of chicken farms and wild birds?,2022-10-30 17:10:46,california
"This is over 2 months old, but it's only gotten worse in California. 

Bird flu has been detected in domestic flocks in both NorCal  and SoCal. 

It's showing up in wild flicks with birds dying and being taken to bird rescue groups.

Take down your bird feeders.",2022-12-21 16:36:10,california
"For everyone commenting who obviously didn’t read the article (or the whole headline “hard to find [bird flu]”)

“The cause is an unprecedented outbreak of highly pathogenic avian influenza — commonly known as bird flu — that has killed tens of millions of egg-layers nationwide. Among these are millions of cage-free hens California relies on to comply with Proposition 12, the 2018 animal welfare initiative that took effect last year.”",2023-01-07 12:27:56,california
Read the article. A new outbreak of bird flu caused the loss of millions of egg producing hens. There’s an actual shortage of eggs not price gouging.,2023-01-07 14:48:14,california
"Man I would give anything for my little one to eat eggs! I’m so jealous.

(Oh yeah and the bird flu thing is bad too)",2023-01-07 21:10:27,california
I read the article. Solves the mystery I've been going through of why are eggs so expensive. It's a bird flu that has killed many millions of chickens and the chickens won't be replaced for several more months. Looks like more frozen breakfast foods for me. I'm not paying a 'premium' price for a cheap food. I know it's uncontrollable but still.,2023-01-08 06:08:46,california
"So long as bird flu is raging through poultry farms, prices will stay up. The reason is that all the birds must be culled if one gets sick. Nationwide more than 50 million chickens have died leading to shortages of eggs and other poultry products.

A bigger danger is if H5N1 jumps to other livestock. Then things get grim.",2023-02-06 16:53:08,california
Bird flu enters the chat,2023-03-01 11:03:44,california
"To help make up for the 21 condors lost to bird flu in AZ

https://www.cnn.com/2023/05/06/us/california-condors-avian-flu-scn-trnd/index.html",2023-05-26 18:40:03,california
"Minus lead in their food, bird flu, etc.",2023-08-29 02:20:31,california
"Just being real. 

They try to capture each condor once a year and weigh them and do blood work on them, and too often they have to treat them for lead poisoning.

And in Arizona several Condors have died from bird flu. Luckily there's now a vaccine, so they're now treating the California-based condors with the vaccine.",2023-08-30 12:06:38,california
Especially after some condors died in AZ because of bird flu. :(,2023-09-28 13:19:21,california
My pet chickens had the bird flu last year. They all survived,2023-12-15 18:44:58,california
Then I shouldn’t care about anything else unless it involves nuclear warfare by your own perspective. Even if the bird flu becomes an epidemic among people.,2023-12-27 19:07:18,california
I heard some sort of bird flu required culling millions of chickens which impacted egg prices. Does not seem strange.,2024-01-06 14:48:48,california
Corporate greed. Doesn’t change the fact that the reason eggs prices went up is because of the bird flu.,2024-03-19 17:34:10,california
"So please explain with scientific evidence how a cow that is a bovine and a mammal can get bird flu, birds are not mammals so how can a cow that a herbivore get virus from a bird that could infected?",2024-04-14 14:20:05,california
How do humans get bird flu?,2024-04-14 14:34:59,california
Who could have possibly known that feeding ground up infected chickens to cows could give them bird flu?,2024-04-14 19:51:20,california
"I'm not worried about the bird flu, I already had the bird flu.  I'm worried about the Turtle Flu!",2024-04-14 21:22:38,california
Bird flu.,2024-05-24 18:01:49,california
"Once we are passed all the avian flu stuff, I can’t recommend enough the window suction feeders (Amazon $12-20). They’re made of acrylic (boo hiss to plastic, but…), so you can see absolutely everything when they visit the feeder.",2022-12-14 11:02:38,california
"We’re going to see a lot more mammalian deaths from Avian flu in wildlife as it continues to spread globally. Specifically among mammals which eat the carcasses of dead birds. Given that we’re seeing it on every continent at this point, and to a growing variety of mammals, it’s probably safe to say that’s going to continue happening. 

Now bobcats aren’t people. Sea lions aren’t people. Foxes aren’t people. Mink aren’t people. And so far transmission to humans is rare. However now is a good time for people to be taking extra caution around wildlife and poultry production. This isn’t just farming, but also hunting. Now would be an exceptionally poor time for hunting birds, especially for consumption, unless you have some way to test for avian flu in the bird prior to doing so. 

there’s no reason for serious concern at this point provided simple precautions are taken. However precautions are warranted. We know mammal to mammal transmission is possible, we’ve seen it in sea lions and mink. We know bird to human transmission is possible. As long as we’re cautious, hopefully we won’t see human to human. 

If we *do* see human to human, there isn’t necessarily any reason to panic, but again, exercising caution and adopting pandemic-like measures of masks in public, etc would offer a measure of personal protection and perhaps peace of mind.

It should also be noted that we have several currently effective avian flu vaccines. The downside is they mainly require chicken eggs to incubate, but unlike with covid, we have ready to deploy measures.",2023-02-24 16:48:09,california
"I've got a couple of wildlife rescue groups in my Facebook feed. They're all following special protocols with their bird intakes, even though they haven't found any with Avian Flu yet.

And zoos are taking special precautions with their bird collections too because of Avian Flu.",2023-04-15 13:35:54,california
"Yes, very nice little zoo. Unfortunately, a lot of our bird exhibits have been shutdown due to Avian flu.",2023-04-15 14:24:34,california
"Nothing specifically about California. 

&gt; The disease has been found in northern Arizona, among the bird’s Southwest flock, which straddles the Arizona-Utah border, says the service. Avian flu has not yet been confirmed among any condors in Utah, California, or Baja California, Mexico.

u/CSmith89

Post deleted.",2023-05-06 11:37:15,california
"Well, the public isn’t geniuses, for one. I hope the lessons learned during the COVID pandemic were learned, shared, and acted on. We are looking at a nasty variant of the avian flu crossing over to humans, here soon. Fingers crossed it doesn’t, but, we are in the, Find Out Century. 

Public lesson: don’t wait for a catastrophe to happen to be prepared. Get a stock of toilet paper, canned goods, and water. We are bound to have an earthquake or another pandemic at this rate. Be prepared my fellow Californians. Be prepared.",2023-09-10 18:51:47,california
Remember when they acted like there was a shortage last year when there was no shortage and price fixed? Good times. Guess we taught them they can cry avian flu and Jack up the price of eggs.,2024-01-29 07:56:16,california
"Egg prices increased because one farm was hot hard by an avian flu, so they had to raise prices.


Then everybody else was like, good idea and raised their prices accordingly. ",2024-03-19 07:55:15,california
"Egg prices jumped because of the avian flu and they had to slaughter millions of birds. Number of cases of bird blu in humans has been low, but it killed around 39% of the people that caught it so they really don’t want it to spread to other animals then spread to humans.",2024-03-19 17:05:36,california
"Right? Birds can swim, fly and walk. They're not a whale. I don't know how ""stranding"" is an appropriate term. If it's avian flu or botulism, why not just say that?",2024-05-05 20:06:59,california
"Original title 

&gt; Avian Influenza Virus Detected In Wild Birds In California

From the posting rules in this sub’s sidebar: 

&gt; Don't modify article titles except to add a location in brackets unless the title is excessively misleading, vague, or clickbait-ish. Don't rely upon reddit's ""use suggested title"" feature. Do include the article's subtitle if it makes things clearer. 

u/SolitaryMomeRath

Post deleted.",2022-07-15 12:43:23,california
"Is this ""scare"" news? I thought you could cook poultry to an internal temp of 165F and it would kill any and all bacteria including avian influenza. Is that not the case or...?",2022-10-05 16:59:08,california
"&gt; By the end of spring, avian influenza had killed 21 condors out of the flock that soars over Arizona and Utah—and Blackford says the outcome could have been much worse.",2023-08-29 14:31:51,california
"You need someone to tell you that diseases can be transferred between species? Avian influenza (there are a bunch) PRIMARILY infects birds, hence the name, but it's not limited to them.",2024-04-14 14:41:45,california
Avian Influenza is typically spread to ag animals by wild birds during migration. Even industry people hadn't seen this happen before.,2024-04-14 17:13:24,california
Watch them give someone h5n1,2023-07-01 01:35:08,california
Do they have H5N1? Poor babies.,2024-05-05 21:24:48,california
"There is not really any evidence of human-to-human transmission of H5N1. Most likely you had something else like RSV or simply a different kind of coronavirus, which have been around forever.",2024-05-15 19:20:18,california
"If bird flu &amp; it spreading through the feces is the issue, that changes things drastically. It becomes a pathogenic issue &amp; not just a “we don’t like the poop” issue.",2022-04-15 00:09:34,pennsylvania
You can track bird flu rates and see a 2x weekly updated map of outbreaks by county via the CDC website: https://www.cdc.gov/flu/avianflu/avian-flu-summary.htm,2022-04-23 09:08:30,pennsylvania
"Can hummers spread bird flu?

I wanna hang out my sugar feeders but I don't want the virus to spread.",2022-05-18 13:29:05,pennsylvania
"Yeah yeah and the same media sensationalism said Trump was the end of the world, just like they said about GWB, the hole in the ozone layer, ISIS, the bird flu, etc. Yet we're still here",2022-05-24 15:05:33,pennsylvania
Edit: so bird flu unfortunately represents only one issue here.,2022-06-08 13:24:48,pennsylvania
Bird flu is reeking havoc on the egg market.,2023-01-07 00:18:48,pennsylvania
See if you can find a local farmer. The giant aggro corps have been hit hard by the bird flu,2023-01-07 06:04:23,pennsylvania
It's not due to inflation its due to a bird flu epidemic...,2023-01-07 06:45:23,pennsylvania
Good old bird flu. Those birds need the damn vaccine. Big Pharma got this 🤪💉🤣,2023-01-07 09:07:30,pennsylvania
"It's going to be hard to blame a viral bird flu on Joe Biden, I think.",2023-01-07 11:27:48,pennsylvania
The huge captive factory farm bird populations  are what allows bird flu to take hold.,2023-01-07 23:29:21,pennsylvania
And never mind that pesky bird flu.,2023-09-18 19:30:20,pennsylvania
SB 979 is super important with bird flu popping up in cows now.,2024-05-09 22:12:03,pennsylvania
This is how we end up with bird flu,2024-05-10 09:19:53,pennsylvania
"Absolutely stupid and dangerous to consume raw cows milk products right now with bird flu being found in like, all of our dairy supply. It is legal though, as long as they have a permit.",2024-05-10 09:23:22,pennsylvania
"Yeah I wouldn’t drink it because there’s a strain of bird flu that has been spreading to cow herds throughout the US.   Pasteurization makes the milk products safe from this, but raw milk will spread it.",2024-05-10 10:13:35,pennsylvania
"Yeah but be clear pasteurization makes milk from cows carrying bird flu safe to drink.  It’s not in all the dairy supply, but rather in a few different herds in a few different states.",2024-05-10 10:15:52,pennsylvania
"For real yo! 20% of tested dairy products in the USA now contain bio markers from the animals having bird flu. A couple of smaller South American countries have just banned the import of dairy from the USA. Do t worry though, the FDA says if it’s homogenized that there is nothing to worry about. Considering the money tied up in this industry and the liars that make up the FDA, I’m quitting dairy for a while.",2024-05-10 10:29:15,pennsylvania
"Okay, all for personal freedoms until it hurts someone else. Have you heard of bird flu? It’s how the world ends. Maybe quit the dairy for a bit. We don’t need this becoming endemic.",2024-05-10 10:31:22,pennsylvania
"When raising chickens for consumption in Europe, they don't do some of the things we do over here. They are required to clean out the chicken barn between rounds of rearing chickens, we just throw the chickens in on top of the excrement the last batch left.  
When we do clean out the barns, we feed the crap left behind to the cows, who are literally eating chicken crap, and we wonder why bird flu is showing up in the milk.  
Anything for cheap wings I guess.",2024-05-10 10:52:21,pennsylvania
"Probably need to rethink the selling for animals as well. The bird flu in raw milk has already killed several cats. 

https://thehill.com/homenews/administration/4636692-cats-died-after-drinking-raw-milk-from-cows-infected-with-bird-flu-cdc/

https://www.cbsnews.com/news/cats-died-after-drinking-milk-bird-flu-infected-cows/",2024-05-10 11:45:43,pennsylvania
"Does boiling? I've been wanting to get more into cheese making, and the form of cheese that I make involves boiling the milk. But if the milk has been hyper pasteurized it doesn't boil and curdle the way you need to for cheese. And unfortunately, it does not say on the label if it has been hyper pasteurized or singular pasteurized. So I was thinking if possibly getting unpasteurized milk for the cheese, but if it's not going to kill viruses like bird flu then it's not worth it.",2024-05-10 11:46:03,pennsylvania
Do you want bird flu? Because that's how you get bird flu,2024-05-10 11:50:44,pennsylvania
"that is a very specific example of a zoonotic disease that didn't kill people, which is fantastic 

that said, we still have to worry about Bird Flu, TB, Brucellosis, and other diseases that can be passed through unpasteurized milk ....",2024-05-10 13:26:40,pennsylvania
"We as a country allow the practice. How do you think the cows are getting bird flu?
Some agriculture practices are better than others. Not everyone farms to the lowest common denominator, but some do.

It’s not best practice to regrind old meat with fresh meat and sell it as hamburger, but it got done a lot until people started dying of e.coli and HUS syndrome.",2024-05-10 14:50:00,pennsylvania
"They are finding remnants of the bird flu virus in pasteurized milk right now.  It hasn’t jumped to humans yet but if it mutates and makes the jump to pigs, we are next.  I strongly recommend not consuming raw milk. If bird flu makes the jump to humans it will be catastrophic",2024-05-10 17:45:19,pennsylvania
"With Bird Flu on the rise in cows on top of salmonella, I would steer clear. It’s usually safe for animals but some human think it’s healthy",2024-05-10 17:57:34,pennsylvania
"A week or so ago, there were a bunch of news articles about how fragments of the bird flu virus were found in pasteurized milk across many states. So the virus in milk is more widespread than a couple herds in 3 states BUT the pasteurization process kills it so the pasteurized milk is safe. I think that's what the person you were talking to meant, not that active bird flu was in milk in PA.",2024-05-10 18:51:21,pennsylvania
Just as bird flu starts to make ground with dairy cows? Unpasteurized milk is one of the few ways to get it outside handling the cows themselves.,2024-06-09 15:57:54,pennsylvania
"Show me where there has been a tranmission through the gut from raw milk in that study?

How many Amish have bird flu?

Ohhh that's right. Zero.",2024-06-09 20:31:21,pennsylvania
There was bird flu transmission to cows which also spurred the emphasis on pasteurization.,2024-06-09 22:10:38,pennsylvania
People are literally buying up all the raw milk so they can “immunize” themselves against bird flu.  They are so fucking stupid.,2024-06-09 23:08:49,pennsylvania
They want the bird flu in there.  They think it will make them immune to it.  Idiots falling prey to conspiracies.,2024-06-09 23:09:54,pennsylvania
"Public health is everyone’s concern.  Idiots are trying to infect themselves with bird flu.  Before you know it, we’ll have human to human transmission and then that’s it.  A deadly flu pandemic is on the horizon.  Influenza is far worse than covid.",2024-06-09 23:15:44,pennsylvania
"&gt;Also what is the common threat to people near people who drink raw milk? Almost nothing if not absolutely nothing. 

Bird Flu, which is now in our cattle, and spreadable to the rest of the population.",2024-06-10 10:49:08,pennsylvania
"&gt;How many Amish have bird flu?

&gt;Ohhh that's right. Zero.

Source?",2024-06-10 10:58:15,pennsylvania
"Technically they are right, bird flu can't infect you further if you are already dead from it.

All true Trump voters know this one weird trick for outsmarting Fauci!",2024-06-10 16:26:58,pennsylvania
"My “side gig” is aviation and wildlife photography… There is nothing as peaceful and soul healing as walking around nature preserves and just enjoying unspoiled land and the creatures that inhabit it. This makes me incredibly angry that in the midst of a severe avian flu outbreak where thousands of birds are dying, some idiot doesn’t think there are enough dead birds.",2022-04-19 18:46:37,pennsylvania
"Hi, I actually work at one of the state diagnostic labs and I can tell you how this works. Once something is positive here, it gets tested at the USDA labs in Iowa. If it's confirmed positive, the flock is depopulated. Most of my job is routine testing for avian flu because there are many surveillance programs in the department of agriculture to try and prevent an unmonitored outbreak from happening. 

Once there is an outbreak, we continually test farms within a certain radius of the first one. 

So both? We test for surveillance but in some cases a farmer may notice increased mortality and ask to be tested.  Hope this helps😊",2022-04-20 11:50:22,pennsylvania
"Correct, from what I've read, avian flu is much less likely to affect songbirds.  Now I guess if you bring hawks and eagles into your feeders....",2022-06-07 14:15:17,pennsylvania
Again with the avian flu?,2022-08-13 11:14:38,pennsylvania
Yeah there has been massive outbreaks of avian flu spread by wild birds.  They’ve been culling millions at a time to attempt to control it in Lancaster county. This tends to impact the supply of eggs.,2023-01-07 10:09:54,pennsylvania
It was some kind of avian flu not corona. But yea,2023-01-07 11:06:27,pennsylvania
"The price of eggs has gone up due to outbreaks of avian flu in chickens.  Even if only one chicken tests positive for avian flu they have to kill the entire flock.  This has caused a big reduction in egg production.

I haven't been to our local Wegmans here in NC recently to see if they've raised the price here again.  The last time we went there, which was before Christmas, the 18 count eggs were 2/$8.  2/$14 sounds about right compared to other stores in my area.  Our local Food Lion is selling 18 count eggs for $7.49.  A dozen is $5.19.",2023-01-07 11:41:39,pennsylvania
"Oh you wish

I joined a chicken group on Facebook(yea yea I know, moving on) cuz I was thinking about getting a couple a while ago, and when the avian flu shit went down initially everybody was screaming their heads off about it being a false flag government control thing.",2023-01-07 12:02:13,pennsylvania
"We culled 49 million chickens last year. 

That's 49,000,000 chickens that were killed, and discarded. 

We didn't eat their meat, they aren't laying eggs. They're just rotting in a landfill. Avian flu tore through the barns like nobody's business. Its why the cheap eggs are gone and the more expensive eggs are roughly the same price - because they had less loss due to better animal husbandry and reduced spread of disease.",2023-01-10 01:40:35,pennsylvania
We don’t eat the egg laying chickens. Different farms. The egg layers aren’t being hit as hard by the avian flu.,2023-01-10 21:05:45,pennsylvania
"You can also find an open letter from the CEO of Exxon to Joe Biden basically saying that they're never expanding refinery capacity unless the federal government pays to build it for them.    

&amp;nbsp;   
The company that owns Eggland's Best, Land o' Lakes, and a bunch of other companies is jacking up egg prices despite not being affected by avian flu, because they can.    

&amp;nbsp;  


It really isn't good that we have companies that can essentially punish the electorate for voting in politicians they don't like.  Someone should really do something about that.",2023-01-22 14:25:38,pennsylvania
So you think the culling of millions of egg laying chickens in response to the worse avian flu outbreak this country has seen is a scam?,2023-01-26 10:30:22,pennsylvania
The H5N1 looks like no joke when it comes to avian flu.,2023-03-16 16:48:21,pennsylvania
"Wages have increased, as well as supply chain costs. You might've missed that an avian flu wiped out millions of birds? Prices rise on variable other than wages. I know that's hard to comprehend simply than bemoaning ""greed"".",2024-02-15 17:19:26,pennsylvania
"I agree. Factory farming is painful and brutal. The USA goes out of its way to hide it with AG gag laws. It’s not small farms. Corporations. 
I’m not against hunting as people are then out of the brutal pain of factory farms. The avian flu in cows is definitely a wake up call.",2024-05-07 18:17:47,pennsylvania
"You make a good point. There’s no objectively correct answer to the question of how far the government should go in curbing people’s freedoms in the face of disease outbreaks. Most people agree that short term restrictions are appropriate to save lives. 

In the case we’re talking about here I think it’s important to remember that person to person transmission of avian flu is rare. 

An uptick of avian flu is certainly something that folks should consider when deciding whether or not to purchase raw milk but I don’t think we’re at the point where it’s appropriate to ban it. At least not personally.",2024-05-10 10:42:08,pennsylvania
"Imagine if you will when a gallon of gas costs over $5.00 per gallon and you have to go see a gastro specialist at Temple University twice a month and you live over two hours away.  

Now imagine further you have to go to the doctors office 3-4 times a week.  The office is about 13 miles away.

Oh yea can't forget about the bills....  PP&amp;L rates have almost doubled, and even the chicken and eggs you buy have gone up in price because of the Avian Influenza.  Luckily your lease is locked in, and now your vehicle needs 4 tires and a control arm for inspection.

Oh yea almost forgot have to arrange a graduation party for your son...

Imagine doing that on only $3000 total....  Welcome to my world 🌎🌎🌎",2022-06-09 01:08:46,pennsylvania
Avian influenza is hitting a lot of egg producers. Prices and shortages are going to continue to rise for a while still.,2023-01-09 20:20:41,pennsylvania
