Comment,Date,Subreddit,Sentiment,Intensity
"No offense to OP, but this post is a prime example of conspiracy thinking. I’m not calling you a conspiracy theorist, I don’t know you and I don’t know how serious you are about this idea. But I like breaking down this kind of thing…

“I found a dead bird in my yard. There are no apparent injuries, so the explanation isn’t obvious.”

There’s nothing wrong with this as an observation by itself, but the next step before adopting any explanation would be to come up with a testable hypothesis. “I don’t see another explanation” is not the same thing as “there is no other explanation.” It’s called an argument from ignorance fallacy: I don’t know any other explanation, so I’ve adopted this one. 

“There are harmful chemicals in the air due to the East Palestine incident. Last night it rained and now there’s a dead bird. Could it be related?”

Again, as a question, there’s nothing fundamentally wrong with asking this. But a suggested explanation shouldn’t be adopted without clear evidence. “It’s possible” is not the same thing as “it’s actual.” Plus, one would need to demonstrate that a specific explanation is even possible before offering it. Has it been demonstrated to be possible for chemicals to travel from East Palestine to Dayton through clouds and rain? If it’s not shown to be possible, it’s not a candidate explanation. 

And correlation is not causation. “My rooster crowed this morning and the sun came up. My rooster must have caused the sunrise!” Two things happening near each other doesn’t mean there’s a causal link. 

Further, we have a single dead bird being floated as a possible pattern. We haven’t established a pattern yet, but let’s say we did. Let’s say more dead birds are found… maybe 5, maybe 10, maybe 1000. Maybe every single bird in Ohio drops out of the sky and dies. We would still need evidence to demonstrate a link between the events in East Palestine and the death of the birds. Simply assuming or asserting a connection is not sufficient, it must be demonstrated. 

Maybe, as another commenter pointed out, it’s avian flu. Maybe there are toxic chemicals in the air from the train derailment AND there’s also something else killing birds. Both could be true. Conspiracy thinking tends to adopt a simple explanation quickly, without considering all options. (Simple meaning satisfying to the person; it doesn’t mean conspiracy theories can’t be complex or complicated. Look at the various features included in OP’s potential explanation)

Conspiracy thinkers also fixate on anomalies. They focus on specific details which stand out or don’t seem to fit, while sometimes ignoring or missing other data. There may be hundreds of living birds flying around OP’s house, but they’ve focused on the dead one. If this is done intentionally (pointing to specific examples that match the theory and ignoring examples that don’t), it’s called cherry-picking.",2023-02-16 01:16:10,Dayton,Sadness,0.6026977300643921
"Yeah H5N1 is wildly out of control everywhere. You should expect to see more dead birds, avoid them.",2023-02-16 05:22:48,Dayton,Anger,0.9142105579376221
"It's not just the price of feed - H5N1 has also done a number on poultry &amp; egg prices.

Budget &amp; local/sustainable food is kind of an oxymoron. You are going to pay a premium for free range eggs and meat, generally speaking",2024-06-19 01:48:33,Dayton,Joy,0.9996240139007568
"Oh no! Are the flamingos and penguins still out? They were when we went a few weeks ago, but maybe there’s been another spike in avian flu cases. They’ve also had a few animal deaths over the last few months (including the capybara 😭).",2023-05-02 09:33:43,Akron,Sadness,0.9866917133331299
"There's a bird virus going around. They're protecting the penguins from getting it. 

From their site: 
https://fb.watch/d7GdmwdhOI/

""Where are the birds?
Many of our birds have temporarily moved indoors or inside a protected habitat. This is as a precaution for our birds’ safety as cases of highly pathogenic avian influenza have been detected in Ohio. Currently, all of our birds remain healthy.

There is no apparent risk to humans at this time. For our birds here at zoo, the risk comes from native birds who land during spring migration.    

We know you love our feathered friends as much as we do. The health and welfare of our birds is our top priority. They will all return to their outdoor habitats as soon as the risk of exposure is low.""",2022-05-21 04:43:05,Akron,Sadness,0.7381851673126221
"I've been seeing a ton of dead birds, both full size, nestling and fledglings, even more noticeable because I have a puppy now. Likely roaming cats, sadly. No real way to tell if it's poison without sending them out for testing, although they might be able to test the robin for bird flu.",2023-07-08 03:46:56,Toledo,Fear,0.9574858546257019
