Comment,Date,Subreddit,Sentiment,Intensity
"Here's my thoughts to politely disagree with you and why

Put all the covid stuff aside for a minute - think for a moment about the very high chance we have of another pandemic with a completely different disease.  Right now bird flu has been infecting birds and mammals globally and spreading rapidly. very rarely it has infected humans and has not yet transferred human to human. But when it has infected humans, it's roughly a 50% survival rate. About half the people infected so far have died.  It is a matter of time before this virus mutates so that it can be transferred more easily to humans and between humans.  Seriously - this is not an if but when. 

And when that happens think about all the people who refused to wear masks in public during covid who got violent and acted out and thought covid was fake - now we have those same people who are going to hop on the conspiracy train again ever more than last time because there's ANOTHER pandemic.  Except now instead of a 1% death rate like with covid it's almost 50%.  

 There will still be people who have to go out in public to keep society running. Can you imagine if that was you, or someone you love knowing that if they got infected it would be a coin flip if you or they survived?  

I would want our government to use every tool we had to help protect everyone I cared about, so that the people who had no choice but to use public transport and public spaces would be a little more protected and maybe not have to get sick and suffer and die because some selfish assholes who were lucky enough to not get killed by the disease value their personal liberty so much they will kill half the other people they spread the disease to.  

I don't think we will have mask mandates again for covid. I think politicians talking about them now is because we have another variant and it becomes a talking point and a way to rally their base and garner support and make people mad about a problem that doesn't exist anymore. 

 But to make this impossible to do in the future when we could have a much more deadly disease where we want every tool available to curb the spread and keep our society and economy functioning is short sighted.",2023-09-07 03:22:46,Ohio,Sadness,0.7277144193649292
"Yeah, but according to an earlier post, home farmers are too dumb to know what they're doing /s

Corporatism is a disease worse than this bird flu.",2023-11-29 00:01:29,Ohio,Sadness,0.9913698434829712
My mom says the same. There was a huge bird flu last year that killed like 4 million or something. (In Ohio) We kept finding dead birds all over the playground where I teach. Like 2 or 3 each week. It's so sad. I guess there is a book called Silent Spring about the death of birds. Its terrible.,2024-01-25 10:33:37,Ohio,Sadness,0.9999203681945801
"So no one is gonna complain when the price of eggs goes back up after another bird flu cull, right?",2024-02-02 06:57:42,Ohio,Anger,0.9247804880142212
"They need to be taken out of the wild. Bird flu could easily spread to cats, who may give it to us. Not to mention they are driving birds to extinction.",2024-03-08 19:12:24,Ohio,Fear,0.9860397577285767
"Didn’t know that bird flu only affected meat chickens. Chickens at mass farms were affected too. 


Quote from The Hill reporting on the current state of our meat and egg farm. 

“Plus, egg prices haven’t fully recovered from the ups and downs of the past two years. In 2022, when bird flu knocked out 10% of the country’s laying hens, prices skyrocketed.”

https://thehill.com/homenews/nexstar_media_wire/4579276-chickens-and-cattle-hit-with-massive-bird-flu-outbreak-will-food-prices-go-up/amp/

Please keep it in reality.",2024-04-08 05:39:54,Ohio,Sadness,0.9749053120613098
"So a continuous up tick in likes for this posting and the continuing down voting of counter points. Yes I would say that gives me the evidence to make my claim. 

So this administration has nothing to do with prices going up. That has to do with corporate greed and price fixing plus other reasons. For example the price of eggs. The price of eggs was affected by a bird flu that wiped out millions of our chickens. Both meat ones and egg production ones.",2024-04-08 08:37:38,Ohio,Anger,0.848487913608551
"Biden has nothing to do with the cost of things. Oil companies durning the spring of 2020 said they would cut back production of gasoline. Then in 21 they said they would have a very hard time getting back to prepandmic levels. It is super easy to stop though. 

Same thing for the cost of groceries. For example the recent price hike in eggs. That had to with a bird flu that wiped out millions of chickens in America. Chickens make eggs. Millions of chickens are now dead and can’t make more eggs. That will cause a shortage but only short term. Prices are now going down.",2024-04-08 12:25:01,Ohio,Anger,0.7869799137115479
"don't look now but this year's bird flu is killing lots and lots of mammals and apparently freaking out a few scientists by how easily and often it seems to be jumping from one mammal to another.  like, i believe i heard that it wiped out an entire seal colony's  pups this year.

eggs are going to go back up in price

they've had a few animal &gt; human cases too.",2024-04-24 02:16:22,Ohio,Anger,0.7423089742660522
"Explains the bird flu. Now, how do you explain your monkeypox?",2024-05-27 23:55:55,Ohio,Sadness,0.978477954864502
Boomer Remover 2: I gots Bird Flu,2024-06-14 23:39:56,Ohio,Fear,0.8494431376457214
Not going to any fairs this year due to avian flu. A close relative studies bird flu for a living and a good friend of mine works in the dairy industry - this is not the year to be around the animals for me and my family. I'll miss the fairs but there are other things to do.,2024-07-16 11:33:49,Ohio,Sadness,0.9995195865631104
"Avian flu required millions of domestic birds to be culled this year/last year, so I suspect that would hinder a lot of exhibition for poultry. Unfortunately in the pandemic, many older farmers have also passed away, and farming is already a declining profession with a high average age. As others mentioned, the price to raise livestock is high right now, so there may be fewer schoolkids showing animals. 

The best way to keep these traditions alive is to take up the spade yourself, even if all you have is a balcony or community garden.",2022-08-10 08:52:24,Ohio,Sadness,0.9977883100509644
"many small fish two weeks ago in a creek that was directly impacted as confirmed by ODNR, crews working in those waters are wearing little protective gear and there are signs of what appear to be diesel in many of the photos.

possibly credible claims of foxes a at one location and chickens at another, but chickens were dying all over the state from avian flu before this and neither of those have been confirmed as to cause",2023-02-16 10:36:11,Ohio,Fear,0.9208742380142212
"The egg price thing is a twofold problem. First, there was a bad avian-flu that caused something like 50 million chickens to be euthanized. But then came the 2nd problem, mega-corporations that control the egg industry used the avian-flu as a reason to price gouge despite supply returning to normal.",2023-04-27 02:41:34,Ohio,Anger,0.9930046200752258
"It'll be super cool if companies stopped building these sites over our wetlands. We only have 1.8% of them left. Idc what you build, just bulldoze somewhere else. Man-made wetlands are not equal to the ones that are removed. 

Oh, and guess which governor removed wetland and ephemeral stream protections under the last administration that denied adding wetlands to the Clean Water Act? 

Hint, the same one who's responsible for the largest bribery scheme in Ohio's political history where First Energy owes the state over $300mil, rolled back food safety during an avian flu outbreak, literally forced state parks to allow fracking, tried to remove birth control, says we can't teach sustainability in college, teacher's can't protest, won't allow state employees to work from home, OH YEAH and got paid THOUSANDS not to strengthen restrictions on railroad safety right before the train derailment AFTER THE LARGEST BRIBERY SCHEME TO BE BROUGHT INTO COURT. There's more but we don't have time for that today. 

He is a puppet to whoever writes the largest check. Those extra 1,000 support jobs won't go to ohio citizens, they'll be outsourced. The 230 will be the lucky ones but I guess as long as our college education is going down the toilet it's either work for Amazon or the steel manufacturers",2023-06-27 04:08:19,Ohio,Anger,0.911244809627533
Highly pathogenic avian influenza. No bueno.,2022-09-08 09:21:28,Ohio,Sadness,0.8647779226303101
"Did they have their chickens tested for high-pathogen avian influenza (HPAI) which has been documented for the past 12-18 months wiping out backyard flocks all around the state?

Just saying this is much more likely the cause than due to the train derailment that happened downwind.",2023-02-14 00:47:32,Ohio,Fear,0.9938663840293884
"Egg price has been so volatile due to Highly Pathogenic Avian Influenza over the last two years infecting flocks in the US resulting in lower egg production. I doubt ""record profits"" is a term that anyone in egg production over the last decade is familiar with.",2023-11-27 00:07:08,Ohio,Anger,0.9492224454879761
"The Meijer in Mentor is much cheaper than nearby GEs, especially if you use the Mperks discounts.  And ALDI and Marcs typically are cheaper than Meijer on many items, although Aldi house brands IMO may not be as good as Meijer house brands, most especially if you desire salt free or low fat options!  Fortunately, the Mentor Meijer and a Wal-Mart, Target, Sav-a-Lot, ALDI, GE, Trader Joe's and Marcs, all are located within 3.3 miles of the Mentor Ave. strip in Mentor and Painesville Township.

E.g., a couple days ago I bought a dozen jumbo eggs at Meijer for $1.69, a superlative price today given the bird flu.",2022-04-28 08:14:28,Cleveland,Joy,0.9209572076797485
"For those wondering why eggs skyrocketed in cost, it's because this has been the deadliest year for bird flu ever, possibly, and millions of egg-laying hens were put down (when a farmer has an outbreak, they generally kill all their remaining birds -- even healthy ones -- to prevent spread to humans). Expect prices to remain high for several months as the industry slowly recovers.",2023-01-09 12:43:28,Cleveland,Anger,0.7216812968254089
"That’s not the main problem, 2022-2023 has been the one of the worst year of bird flu in US history, 53 million birds in the US culled. Anytime there is a outbreak they kill all the birds healthy and non, to limit spread to other birds and people.",2023-01-09 21:13:39,Cleveland,Sadness,0.9830102920532227
"&gt;as the industry slowly recovers.

before anyone asks: no the industry isn't just butchering the female egg-layers for those $2/lb chicken breasts.   the chicken breed used for male/meat chickens is different than the one used for egg-laying and is less susceptible to bird flu.

I would expect the ""egg"" industry to expand breeds a little bit, and maybe reduce scale of operations by spreading out, to avoid massive losses. But since egg is a staple of breakfasts and recipes I suspect the industry is [largely still making profits](https://www.marketwatch.com/story/egg-producer-cal-maine-swings-to-q2-profit-amid-rising-prices-2022-07-19) even during this difficult year.",2023-01-09 21:46:41,Cleveland,Sadness,0.9073797464370728
"Ended up buying ""organic"" ""free range"" eggs at Giant Eagle for about the same price last week because that's all that was available.  I'm guessing the Crystal Springs farm where they usually get their eggs from got Bird Flu'd.",2023-01-09 23:37:52,Cleveland,Sadness,0.9818930625915527
"Try one of the indoor farmers markets, either at Crocker Park or Shaker Square. Don’t expect to score eggs week 1 in the winter with bird flu savaging the hen population, but ask about reservations for next week. If you live on the east side, Patterson’s fruit farm has eggs. I think Sages does, too.",2023-01-11 01:57:57,Cleveland,Anger,0.993320882320404
I didn’t even think about bird flu! Thanks!,2023-01-11 03:05:31,Cleveland,Joy,0.8927099704742432
Saw signs there saying they aren't doing it this year due to bird flu,2023-01-24 11:28:26,Cleveland,Anger,0.8056022524833679
Have they tested the dead chickens for bird flu?,2023-02-16 02:33:55,Cleveland,Fear,0.8731257319450378
They made up bird flu to disguise that they're phasing out old surveillance technology.,2024-04-27 08:13:29,Cleveland,Neutral,0.3810655176639557
Covid is so over. Bird Flu! Is the hot new scary disease that you NEED to be CONCERNED about!,2024-06-06 10:59:27,Cleveland,Sadness,0.5294508337974548
"One thing to be aware of with penguins is that there is a very nasty avian flu going around. None of the Ohio zoos have taken procautions yet but other zoos have taken all birds of exhibit so I would check ahead of you are going for penguins.

Also Cincinnati has the Newport aquarium which has penguins too. I like the zoo better though.",2022-03-27 21:26:53,Cleveland,Joy,0.7124418020248413
It's good to hear that some areas have no apparent impact from the Avian flu.,2022-06-01 05:28:48,Cleveland,Sadness,0.6335798501968384
"Eggs increasing make sense outside of inflation though. There was another round of avian flu that was breaking out so there were a lot of hens that were culled to prevent it from becoming a serious issue. Fewer chickens means fewer eggs and the price goes up. This happened a few years ago. The price did end up dropping after a while, not back to the original amount but still lower than the price hike.

Butter is the thing that's killed me with the prices. It's gone up in general, but some places I'll be shopping and see how expensive it is so I'll buy it elsewhere. I've been shopping at Miles Market a lot lately for produce especially because the price and quality is well worth it (Strawberries were between $1-$1.50 per pint, broccolini was on sale 2 for $3, etc.) I was going to pick up a pound of butter while there and Land o Lakes was $7.50. It would've been less expensive to buy Irish butter. I bought it elsewhere but it was still about $3.50-$4 for a pound.",2022-07-28 23:36:34,Cleveland,Anger,0.8462082743644714
There has also been a bad bout of Avian flu. Saw whole groups of dead geese in the summertime. I found a sick baby bird in my yard once and nowhere would take it because it was a) an invasive species and because b) the avian flu going around.,2022-10-26 21:02:50,Cleveland,Anger,0.949571430683136
"Avian flu is still a thing and you can report sick/dead birds here… (it’s a few years old but I bet it’s still is in existence)

https://www.cincinnati.com/story/news/2021/06/29/bird-illness-report-ohio-kentucky-indiana/7794636002/",2023-06-06 04:43:02,Cleveland,Fear,0.8368366360664368
"Kids also love the LakeShore Live Steamers train rides at the Lake Metroparks Penitentiary Glen Park in Kirtland.  There also is the excellent Kevin P. Clinton Wildlife Center there featuring animal ""ambassadors"" when open (currently closed due to the Avian Influenza epidemic)

Unfortunately, there are no train rides scheduled for the weekend of the Mentor Perchfest.

[https://www.lakeshorelivesteamers.com/pub-sched.html](https://www.lakeshorelivesteamers.com/pub-sched.html)

[https://www.lakemetroparks.com/parks-trails/penitentiary-glen-reservation/kevin-p-clinton-wildlife-center](https://www.lakemetroparks.com/parks-trails/penitentiary-glen-reservation/kevin-p-clinton-wildlife-center)

For persons willing to drive a further 20 minutes east from the Mentor Lagoons, there is another long Lake Erie wild beach and an observation tower at the Lake Metroparks Lake Erie Bluffs Park.  While there, check out the two excellent private campsites overlooking Lake Erie and available for rental; these arguably IMO are the best campsites in Greater Cleveland and perhaps the best in Ohio on the Lake Erie shore.

[https://www.lakemetroparks.com/parks-trails/lake-erie-bluffs](https://www.lakemetroparks.com/parks-trails/lake-erie-bluffs)

[http://ianadamsphotography.com/news/picture-ohio-lake-erie-bluffs-lake-county/](http://ianadamsphotography.com/news/picture-ohio-lake-erie-bluffs-lake-county/)

Kids love observation towers (bring binoculars) and the 12-story Kalberer Emergent Tower at Holden Arboretum, where there also is the Murch Canopy Walk, is tough to beat.",2022-05-29 17:17:32,Cleveland,Joy,0.9715843796730042
"[Gatorade bottle shrinkage was from 2022](https://www.denverpost.com/2022/06/08/no-youre-not-imagining-it-package-sizes-are-shrinking/)  


The rotisserie chicken is a H5N1 supply thing. Foster's Farms are the smaller birds apparently.  


We use [Flashfood](https://www.flashfood.com/) to get the chicken right before it expires at GiantEagle but even that has dried up as more people have discovered it.",2024-04-12 04:04:26,Cleveland,Anger,0.9920669794082642
"Bird flu screwed up prices of chicken and eggs as well. Here's an older article about it,  https://pbswisconsin.org/news-item/what-the-2022-bird-flu-outbreak-means-for-wisconsin-poultry/",2022-08-22 22:24:56,cincinnati,Sadness,0.9275239109992981
"Hippos (tucker and fiona) were out today and it was like 33 degrees. The water is warm. There was steam rising off it. Rinos, bongos, kangaroos, little penguins, ringtail lemurs, meerkats, ostrich, kudu, impala, and okapi will be off exhibit. Outside birds are off exhibit right now because of the bird flu. Everything that is in a building will be on exhibit. Everything in cat canyon tolerates cold and has access. Red pandas love winter. Everything in wolf woods is out. Go down at 2:00 and stay for the lights.",2022-11-21 12:28:44,cincinnati,Anger,0.6223483085632324
Starting to see some cost relief from suppliers. Beef is supposed to have a bad year and with bird flu who knows about poultry.,2023-02-16 09:05:13,cincinnati,Sadness,0.9632657170295715
I wonder if the bird flu thing going around hasn’t messed with supply. I’d imagine everyone is trying to buy up the chicks right now.,2023-02-21 01:49:59,cincinnati,Sadness,0.8343979120254517
"With bird flu going around, do not pick it up or mess with it",2023-05-28 10:20:14,cincinnati,Sadness,0.7219576239585876
"Former wild animal rehabilitator  here. If the bird is injured or otherwise unable to escape a predator it will likely die over night.  I can’t believe someone earlier suggested leaving it to die if it were just a starling. Infuriating. 
Bring it inside and put it in a box in a quiet, warm area. If you’re worried about bird flu then simply wash your hands.  In the morning reach out to these resources:

https://ohiodnr.gov/static/documents/wildlife/permits/Ohio%20DOW%20Wildlife%20Rehabilitators.pdf

Feel free to DM me if you have questions. I’ve raised and released thousands of injured/orphaned animals locally.",2023-05-28 10:39:19,cincinnati,Joy,0.999948263168335
"krohns conservatory. its wonderful and next to the art museum. then check out the aquarium, currently theres bird flu around so you cant get the penguin back stage pass which is a bummer because those guys are great and you get to play with them with their little toys. a nice restaurant is symphony hotel",2024-01-07 08:18:02,cincinnati,Joy,0.9995726943016052
"The fact that your convent about people who dont agree with you. Listen, stay boosting. You probably need your election season c0vid, bird flu, combo. 2 at once.",2024-04-22 03:15:44,cincinnati,Anger,0.9584512710571289
That union protects cops from accountability. We need the police union like we need a bird flu outbreak.,2024-05-17 00:49:40,cincinnati,Anger,0.6870377659797668
Also a lot of birds aren't available to see due to the avian flu,2022-11-24 11:26:04,cincinnati,Anger,0.8493492603302002
Bad avian flu this year.  Nationwide shortage.,2023-01-03 10:13:57,cincinnati,Sadness,0.963659942150116
Chicken is insane because avian flu killed a ton. It will come back down eventually.,2023-02-21 07:25:02,cincinnati,Anger,0.9376493692398071
"Eggs have come down in price and are beginning to normalize at prices higher than before the avian flu led to millions of birds being culled, but far below the peak. Simple Truth Natural Cage Free Eggs are $4/doz.

Still, OP is way off base thinking that small, local egg producers selling their eggs at a farmers’ market are going to be anywhere near as low as the prices of industrially produced eggs in a grocery store. Even if they’re sold at cost, that cost also has to take into account transporting the eggs to the market and standing there all day to sell them. I don’t know about OP’s time, but my time is worth more than $10/hr. The economies of scale and having shelf space in a self-service venue like a grocery store are what make eggs affordable, so OP should just stick with store-bought eggs if they don’t want to pay the premium for direct-to-consumer eggs produced by local farmers.",2023-04-01 23:33:53,cincinnati,Anger,0.971581757068634
"That's not how economics works.

Grocery stores have very [low margins to begin with: 1%-3%](https://www.marketplace.org/2022/05/13/how-do-grocery-stores-make-money-when-their-profit-margins-are-so-low/). They aren't making gangbuster profits on your decision to buy a cheaper brand than something more well-known or expensive.

You absolutely should go frugal if you want to keep your budget in check. Skip the processed items and cook from scratch. Meal prep. Plan. Coupon. Shop around for deals from other stores. Skip the organics or the ""all-natural"" lines that just cost more without providing any tangible benefit.

There are bigger issues as to why prices have crept up. The [avian influenza outbreak decimated chicken populations](https://6abc.com/eggs-egg-shortage-prices-why-are-so-expensive/12719329/) at the same time that demand was increasing. Supply chain disruptions. The conflict in Ukraine. Transportation costs. Increased consumer spending. Etc.",2023-02-16 11:53:45,cincinnati,Anger,0.783683717250824
"Gen X with a millennial spouse. We're closing later this month. This is only possible due to equity in my current house, purchased in 2016, which has doubled in value and her inheritance. It's an insanely low inventory market, with decent houses lasting 1-3 days tops in bidding wars, waived inspections, mitigated contingencies, etc. If we lost this last bid, we would have settled on a rehab/ fixer upper.

After the Fed held rates stable and signaled they weren't going to drop them anytime soon, we went ahead with our plans. That was a couple months ago. I really don't see rates like 3% ever coming back. I'm not stupid enough to believe an election will have any influence on the Fed. Rates are now at historical normal levels. We'll refinance if opportunity presents itself.

As for housing stock. Unless there's some magical political will to change zoning policies or a massive catastrophe vacating homes (H5N1, etc.) there doesn't seem to be relief in sight. 

And I don't want to be interviewed.",2024-05-03 12:53:08,cincinnati,Sadness,0.9901614189147949
H5N1 may not be dead there,2024-05-05 04:52:09,cincinnati,Fear,0.9729468822479248
"Bird flu going globally, has a 80 or 90% kill rate in some instances.  For a while the dnr was tracking this.  No clue if they still do.

Edit - Here is a source about it: https://www.theatlantic.com/science/archive/2023/02/avian-bird-flu-virus-outbreak-epidemic/673058/",2023-02-16 00:52:34,Dayton,Sadness,0.5569709539413452
"Prevailing winds are from West to East. It is highly unlikely that chemicals from the EP situation made it here. As another commenter said, bird flu is much more likely.",2023-02-16 01:14:39,Dayton,Fear,0.9312469959259033
"I do think I saw something the other day about avian flu ramping up, could be an explanation.",2023-02-16 00:41:45,Dayton,Neutral,0.4734302759170532
