Comment,Date,Subreddit,Sentiment,Intensity
"https://www.usatoday.com/story/news/nation/2022/02/16/bird-flu-affected-chickens-turkeys-midwest/6814375001/


Bird flu is ravaging the industry.",2022-02-20 11:48:11,Columbus,Sadness,0.9980271458625793
"Hot chicken has been not fairing well compared to other Columbus restaurants I’ve been to since the onset of the pandemic, other than the ones that have closed down, obviously. 

I know the bird flu has been a serious problem for them, though the couple times I went, the chicken was one of the only things that have stayed consistent in quality. Both times all their sides were noticeably worse. I don’t think their Mac is homemade anymore (or at least its more apparent it’s made elsewhere) and the beans were really stale too. Have they been this way before the pandemic and I just now notice? Or is this a recent development? I don’t think they’re changing the tea as often or putting lids on the top of their canisters, one time my friend found a fruit fly in his tea. Overall it seems things have gotten more lax there.

I don’t know if they were just having an off-day both times, or if only the Easton Location is bad, but I just figured the supply chain problems have been making them cut a lot of corners. Even compared to other restaurants around though, hot chicken seems to have been struggling pretty bad. It’s a shame, really…",2022-02-26 10:33:26,Columbus,Anger,0.9911351203918457
"The price of chicken quadrupled for wholesale compared to 2020… not only that labor costs have skyrocketed as well. Ultimately it’s up to you to decide if it’s still worth the price. Tbh you should expect more price increases…the bird flu hasn’t even affected the industry atm, and we aren’t even sure if it’s fully contained yet. 
Maybe the question isn’t “what’s the deal with Hot Chicken Takeover,” but “what’s the deal with this world right now?”",2022-02-26 12:20:46,Columbus,Love,0.9966425895690918
"Do we really need one these posts every week? 

Ffs inflation, bird flu, labor shortages all mean chicken( and most anything you eat out) is gonna cost you and if it doesn’t seem expensive it’s gonna be small AF. 

Also stop complaining on the internet, if you actually want something to change, send a note, leave a comment card etc. Yelp and Reddit are not the place.",2022-02-26 15:11:34,Columbus,Anger,0.9665735960006714
"First covid, some companies had to shut down or limit workers to keep a distance. Then there was a situation, with beef and cows I don’t remember exactly but beef went up to like $7 per pound. Then we couldn’t get gloves or certain things because hospitals needed them first… and the list goes on…. Now we are dealing with the bird flu wiping out the chickens. 

It’s just shot after shot and it keeps getting harder and more expensive. :-(",2022-02-27 05:04:42,Columbus,Anger,0.8781468272209167
"I believe there is also a bird flu going around which is causing many of the birds to be quarantined for their safety. When I went a few weeks ago the flamingos and penguins weren’t out, and the aviary was closed as well.",2022-02-28 01:38:09,Columbus,Sadness,0.5730155110359192
"Yes, I went recently and was disappointed to see the flamingos weren't out due to some bird flu.",2022-02-28 05:33:49,Columbus,Sadness,0.9926266074180603
"Going to be a really tough year to get high quality fresh turkeys, will be very competitive. My normal place wasn’t even able to do thanksgiving preorders this year because of all the kill offs due to bird flu.",2022-11-10 23:11:09,Columbus,Sadness,0.8820182085037231
"But that doesn't seem to prevent their stores from having drive thru lines that wrap around the building.

Also, bird flu is making chicken scarce for every chicken place.",2022-12-19 23:44:55,Columbus,Anger,0.7761812210083008
"Yes. Saw a thread complaining about egg prices with the obligatory “thanks Biden” sentiments, but bird flu was the primary driver of rising poultry and egg costs and trucker transport being a second.",2022-12-19 23:53:14,Columbus,Anger,0.6592364311218262
Bird flu wouldn't spread like it did if they didn't pack them in with no room to spare. Corporate greed has consequences in nature and consumers pay the price.,2022-12-20 11:53:04,Columbus,Sadness,0.9608190059661865
It was also the worst year ever for bird flu.,2023-01-23 20:35:00,Columbus,Sadness,0.7011205554008484
Schiller park. Please don't feed them. Bird flu is going around and you're encouraging the spread of this very deadly virus by grouping the animals together.,2023-03-03 04:52:38,Columbus,Sadness,0.5742163062095642
"Ohh okay. Sorry, I thought you were trying to justify feeding ducks. My guess as to the sign would be because of how much more migratory geese are but I could be talking out of my ass. In general tho, the bird flu is highly contagious and any precaution helps. Feeding any wild animals is always highly discouraged and is almost always bad for them.",2023-03-03 07:32:41,Columbus,Sadness,0.9983371496200562
ducks and geese are all waterfowl and all can spread bird flu or any other disease. Feeding either of them low quality foods like bread is also not good for them at all health-wise.,2023-03-03 09:57:28,Columbus,Sadness,0.5070472359657288
"Man, its stuff like this that makes me enjoy my 40min commute to work in c-bus.   


I love my dog, but we wonder why bird-flu and COVID and all that stuff spreads.........  


I will also say this same thing has been happening on Airplanes, I fly a lot for my job and my lord pre-Covid once in a great while someone would be traveling with an Emotional Support Animal it would be typically some young girl, now I've seen Big Dog's Traveling with Big-Men as Emotional Support Animals its crazy.   


Same with Pre-Boarding people who aren't truly disabled are using this to board the plane earlier. On a flight 2weeks ago there were 48 Pre-Boarding Passengers (Usually maybe 10-max is the standard at CMH)",2023-03-15 21:11:03,Columbus,Sadness,0.9994224309921265
I'm really hoping a nice bird flu will help ease the pressure on the housing market,2023-04-05 21:34:19,Columbus,Sadness,0.9901812672615051
"This is nonsensical. 

So let me get this straight – you want the government to take more of people's money as a threat for them to not sell their business? 

And your reason being is because you think that you know X market better than somebody else? 

&gt;Instead of taking a big payout, it's better to keep the company healthy and paying you for decades to come.

There's no guarantee that it'll pay for decades to come. Maybe the market gets saturated with fried chicken joints. Maybe fried chicken stops being trendy/desirable. Maybe there's a ""health"" push and people stop buying your product. Maybe a strain of bird flu wipes out every chicken farm in the country and suddenly you don't have a product.  

Why on earth are you against people cashing out when the moment is right? Just because a brand is worth a bunch of money now does not mean that it will be worth a bunch of money in two years.",2023-04-24 22:31:42,Columbus,Anger,0.904430091381073
"Roosters wings seem like they came from fully grown chickens, Buffalo wild Wings are sized like the game from bird flu victims, small and desiccated. Their boneless are over breaded and I always feel like shit after I eat them. 5 Stars.",2023-04-28 15:40:12,Columbus,Anger,0.6768953800201416
"I admit I do not fully understand the basis of these inflation charges being added. Fundamentally if the cost of doing business goes up don’t you just charge more for the goods and services you are providing? So could it be laziness like some are implying? And if and when inflation gets better, will they simply drop the fee or if we don’t pay attention will they drop the fee and then raise prices a little? I would think some businesses will start relying on these new charges even if they are small percentages and will include that in planning on the income they expect and will never want to give up this extra revenue. And has this ever happened in the past? I know it’s been a long time since we have seen inflation this bad but I just wonder if businesses did this before. And where does it stop? If the nation gets hit with a big bird flu epidemic and we have to put down our chicken population will the chicken wing joints add a bird flu charge? A drought charge because a drought effected produce prices? You could dream up any charge you wanted to.",2023-05-16 06:33:47,Columbus,Joy,0.9055384993553162
Oh no! Bird Flu incoming?,2023-06-08 20:42:41,Columbus,Fear,0.6638211011886597
"That bird flu variant has been devastating migratory foul (except for geese, of course) and raptors across the US.",2023-07-17 06:39:09,Columbus,Sadness,0.7778798341751099
"Keep in mind a major part of the price increase is due to increased wage costs.

Next is that the US chicken supply was gutted, well terminated, because a few thousand birds were infected with bird flu.  Even though they were mostly isolated in a small local farm, the FDA mandated hundreds of millions be terminated WITHOUT testing to confirm infection.  Along with destruction of hundreds of millions of eggs per year since.  Again, without testing to confirm infection.

Supply has never recovered and therefore costs are higher.  Heck, even grocery store prices for chicken are still crazy high.",2024-05-09 20:10:55,Columbus,Anger,0.9529664516448975
"be careful of bird flu, please keep ur dogs away from any and all wild birds (as well as domestic ones like chickens) https://www.avma.org/resources-tools/animal-health-and-welfare/animal-health/avian-influenza#:\~:text=Certain%20mammalian%20species%E2%80%94including%20cats,considered%20low%2C%20but%20not%20zero.",2024-07-23 02:38:58,Columbus,Sadness,0.5627102851867676
Bird Flu Platter…? That’s a Hard Boiled Hell No!,2024-07-27 22:29:17,Columbus,Anger,0.9785892367362976
"Yes but there's a huge difference between wild city geese and a deer, especially when there's a problem with bird flu going on. It's just not a great idea. It's not something you should encourage.",2024-07-29 02:31:07,Columbus,Fear,0.6284319758415222
With the bird flu going around I wouldn't. But that's just me lol. I joke about putting a whole one in my air fryer often but I don't think it's a good idea 🤣,2024-07-29 02:33:37,Columbus,Sadness,0.6284373998641968
Right as bird flu is popppff too. Nice,2024-07-29 10:02:20,Columbus,Joy,0.9976206421852112
"Egg prices aren’t just inflation, they’ve been hit by avian flu. Birds from bald eagles to chickens to neighborhood sparrows have been affected.",2022-04-20 20:17:33,Columbus,Anger,0.8185582756996155
"No worries. I don’t hold particularly optimistic beliefs about animals that are mostly seen as a resource, but these guys aren’t getting the worst livestock experience. Although I do wonder with Avian flu threats what that looks like for small flocks too.",2022-04-29 23:27:01,Columbus,Sadness,0.9142078757286072
"Eggs are sort of special situation, because of the Avian flu they've culled millions of chickens.

36 million have been culled in 3 months. This has dramatically raised chicken and egg costs.

https://www.vox.com/future-perfect/23053296/bird-flu-chickens-turkeys-cull-depopulation-ventilation-shutdown

This isn't to say it doesn't suck and prices aren't rising, but eggs are a special situation.",2022-06-03 06:18:20,Columbus,Sadness,0.9481092691421509
Well that is partially due to the ongoing avian flu issue with poultry farms.  I am just thinking about margins and what consumers are willing to pay.,2022-10-26 22:24:36,Columbus,Neutral,0.37308797240257263
"Didn't they have to cull like, millions of chicken due to some strain of avian flu?",2022-12-19 23:44:33,Columbus,Sadness,0.7084910273551941
"Chicken (and egg) prices are up like 40%, partially due to general inflation, but also because of avian flu outbreak, which has been particularly bad this year. The guidelines for farmers for when a single bird contracts avian flu is to cull the entire flock. Now the supply of chicken is constrained and the price shoots up.

However, I will say that if Chipotle/other restaurants raise their prices to account for the higher chicken prices AND raises the price of their other protein options by the same amount as chicken; that is price gouging and using consumer psychology to maintain that beef/pork are luxury proteins and chicken isn't. Based on my last trip to Kroger, chicken is basically the same price as beef (ground and cheaper cuts excluding nice steak cuts), so why is there a 20% disparity between chicken and beef on most menus?",2022-12-20 00:15:09,Columbus,Anger,0.8419910073280334
"It’s not just commercial bird farms, though.  Avian flu has hit hard across the U.S., a lot of wild birds died off this past summer.  We had 3 wild turkeys that have visited our yard for the last 3 summers.  Noticed one had developed these nasty wart-like growths on her head around the end of August.  In less than a month, all three had it, and you could literally watch it progress on a daily basis.  By mid-September only two birds were showing up, and one wasn’t looking good at all.  Talked with an avian biologist with DNR, and he said it’s pretty bad.  Said ours was his first report of wild eastern turkeys having it in southern Ohio, but die-offs of other birds were being reported around the state.",2022-12-20 13:37:53,Columbus,Sadness,0.5782352685928345
"From what I heard, there's been an avian flu outbreak and a lot of chickens were culled to prevent the entire population from dying out.",2023-01-23 06:38:41,Columbus,Sadness,0.8836780190467834
"Avian flu.  They are culling birds by the millions to try to curb the spread. As a result, all chicken products are more expensive, and restaurants are serving smaller pieces to keep costs down.",2023-01-23 22:10:49,Columbus,Anger,0.9938420057296753
"The flu? With you working at the CDC and all you should know the flu is colloquial for influenza and the vaccine has two A strains and one B strain of the most virulent strains for the season. Some of these strains aren’t endemic. We had avian flu about a decade ago. Influenza also kills millions a year. Same with RSV in older adults and neonates. That’s why we vaccinate. Are you getting the RSV vaccine?

I never said certain risk populations should not be vaccinated. I said the populace as a whole has no need. There are many coronavirus strains. They cause colds. Just like this one anymore.",2023-09-15 06:45:00,Columbus,Neutral,0.4361160695552826
"I’d argue she’s seeing more squirrels so they only look busier. Their population has exploded due to avian flu killing off a significant number of Raptors, thus putting less pressure on their population.",2023-10-20 08:26:08,Columbus,Anger,0.775090754032135
"Never said I disagreed.  I know avian flu has been a massive issue as of late. Was just saying that I wondered if I am seeing more because they don’t have coyotes to compete with.   

Now for songbirds, it could take out some of the blue jays that seem to have created a colony near by.",2023-10-20 12:09:38,Columbus,Fear,0.991926908493042
"I think the avian flu that went around last year or whenever impacted the food chain. Less birds of prey means more rabbits and squirrels. More of those means more food for coyotes. They seem bigger/ healthier than ever and as others have said, more bold. My theory is they have less competition for food, so they are working their way into the city and eating up all the critters that weren’t necessarily there before due to the birds.",2023-12-31 23:57:27,Columbus,Anger,0.9953206181526184
"I've always put my food waste outside at the very least if not tossed it where I know critters to be.  I am pretty confident and ignorant so it will be tough for me to no longer throw old and stale French fries up in the air near seagulls in busy parking lots and laugh at the mayhem although much more effective than a sign could be has been the ongoing Avian Influenza epidemic. I am afraid to be near birds with that ongoing.

That said (and with a sarcastic streak to boot), I have witnessed first hand (but not by my hands) how regularly feeding geese completely upsets the migratory habits of Canadia Geese.  They are supposed to migrate and eat plant matter near or in water, feeding them regularly causes them to settle at one pond year round.",2024-05-01 00:30:41,Columbus,Fear,0.9990363121032715
"The plural of “Anecdote” is not “Data” 

H5N1 has been devastating bird populations, especially predators going back to January of 2022. It’s part of the reason why chicken and egg prices went up so much. 

Fortunately songbirds seem to have been missed by it. 

[something from the Toledo Blade.](https://www.toledoblade.com/local/animals/2022/04/04/avian-influenza-taking-toll-on-birds-of-prey/stories/20220403065)",2023-10-20 11:00:52,Columbus,Sadness,0.999061644077301
"Idk, I'd hang on to them for H5N1, at least until we have enough vaccines ready to go. Human to human transmission seems inevitable at this point, and 51 farms have already had livestock test positive for the virus.",2024-05-20 07:21:20,Columbus,Joy,0.9810481071472168
"If I worked in a job that put me into face to face contact with a lot of people every day I'd make the effort. Right now all my interactions are 100% voluntary. It' just cheaper and easier to wear a mask when I have to go out.

Save the vaccines for those that truly need them. Some years there are shortages. I haven't heard anything yet how the bird flu culls are affecting the supply of available vaccine.  I won't be surprised to hear there are shortages this year.",2022-09-18 01:13:59,Ohio,Sadness,0.9600995779037476
"&gt;Nope I will pass you can stick your coma right up your free loading ass and second of all yes there is that many ppl on welfare absolutely and further more you being a mental midget missed my point and then………………….and then ………… oh ya and get a job

you're an angry little neckbeard, aren't you?

 btw, furthermore is one word, there, oh intellectual one.  might want to check your own IQ before attempts at insults about mental capacity.

 i'm retired after working more years than you've been alive so you can set all that aside and instead of assuming the worst about everyone in the world except yourself (which apparently you need to do to feel better about your sad self,) you can use the internet to learn a little about supply and demand, and things like bird flu.

i can see by your other comments below that you have no idea how business works, what lost leaders are, or even how to weigh a chicken.

it would be a good start if you pulled your head out of your self-adoring ass and have some empathy for other people.",2023-01-12 05:02:10,Ohio,Joy,0.9999439716339111
"&gt;Eggs? One of the food items that have increased in price the most in the past year?  
&gt;  
&gt;Processed food does tend to be cheaper, even if they need to use Whole Foods as their main ingredients. Process foods are able to use Whole Foods that tend to be cheaper. Ever heard of corn syrup? Why do you think corn is a main ingredient in the vast majority of processed foods.  
&gt;  
&gt;Finally, I find it incredibly ironic that you criticized my point of view for being to simplified, yet the second I bring up economic concepts that are just outside of Econ 101 you disengage and call it a “word salad”. Pick a side man

ok, ok.  so i just smoked a bowl which tends to increase my tolerance for all kinds of pain, including the psychic pain incurred by reading this and the sadness i feel for you to believe all that makes sense.

eggs went up because of shortages due to bird flu, not demand due to poor people getting snap benefits. they're still a great source of protein and dirt cheap compared to say steaks, so your point is meaningless and one i figured you'd latch on to because it's *so fucking simple* and requires no thought past surface ones.

aside from the capitals on 'whole foods' which i'll assume your phone did for you, you're fucking nuts!  why do you think corn syrup is cheap again?  did it occur to you that the starting material must be even *cheaper*?  so much so you can process the shit out of it and still make money.

how about we just mill it into taco shells and give them away.  giving them away will cost more than the fucking taco shells.  labor is much more of a cost in any foodstuff than the actual food, that cost is included in your retail cost.

yes, *your* grasp of economics is certainly just a shade past econ 101, and it shows.

lets start with the bias you show when you categorize food assistance as ""free money"", shall we?  what IS free money to you?

does someone who inherited a house they never lifted a finger to earn receive 'free money'?  how about if they sell the house, buy bonds with that money and get interest every year without lifting another finger?  is THAT free money? 

or, even if they earned it working, and live off the interest, is that free money?

 how about banks that use your deposits to buy bonds and capture that interest?  that free money?  or if they lend against said bonds to capture MORE interest from someone buying a house?  they didn't create that money, or produce goods, not at all, nowhere along the chain, so, is that free money?

i think farmers are just fine with food subsidies, or they should be.  they're still getting paid no matter who consumes it and it benefits all of society when everyone is fed.

creating false dichotomies with 'poisons' isn't thinking through the problem, it's avoiding thinking.",2023-01-12 06:44:39,Ohio,Joy,0.999944806098938
"Russia invading Ukraine is also a factor. Ukraine used to export huge amounts of grain around the world. Drought was very bad in Asia, Europe and North America this year.  Grain harvests weren't good. Then there is the world wide epidemic of bird flu affecting egg/poultry prices. 

   It's not just Covid causing food inflation.",2023-02-02 05:39:37,Ohio,Sadness,0.6201661229133606
"War (Ukraine), drought (Europe, Asia, North America), pestilence (bird flu) probably played a part too.",2023-02-02 05:42:00,Ohio,Anger,0.734276533126831
"over aggressive control freak cops did cop things that had nothing to do with any of the information involved. they got mad at him because they thought he was too loud, ffs. read up on it.

animals exposed to the smoke and any vapors i'm sure are impacted, that's not a surprise to anyone, why would it be a surprise to you?  they ordered evacuation immediately after the crash and expanded it for the burn-off.  anyone with a brain took heed and moved their animals as well.  i think it would be a stretch to think they weren't offered any assistance to do so.  where were all these great country neighbors i hear about all the time?

the most i've seen reported is a fox (which is an exotic pet and shouldn't be one imo) and some chickens.  damn near anything kills chickens, so that's not a surprise. it could have been bird flu even.

who was losing money? either the RR's are so filthy rich, or they're not. make up your minds

there ARE legitimate concerns about water and continued volatile compounds at the site, but frankly, you stand next to a diesel truck for a few minutes and you're getting just as much crap in you.

i mean, it's up to you what to believe, but not everything is a bloody cover up or conspiracy.  i wish you peace of mind and a good resolution to all this. i'm sure it sucks.",2023-02-13 21:21:51,Ohio,Joy,0.9978976249694824
You’re* but seriously have you not seen the news? Bird flu has killed MILLIONS of birds this year,2023-02-14 04:56:28,Ohio,Sadness,0.9956836700439453
"I mean you could provide evidence that bird flu had nothing to do with it, but you won’t, there’s no reason to be hostile, the most likely thing is avian flu",2023-02-14 04:57:40,Ohio,Fear,0.6139062643051147
"Apologies for my poor grammar it must be the bird flu. Chickens are dying cause of bird flu, but the most recent deaths of chicken, foxes, fish can be explained by ground watee pollution why are u so against that possibility it completely plausible",2023-02-14 05:17:01,Ohio,Sadness,0.9994514584541321
"Im sorry for my hostility, tbh im in a shitty mood and seeing this shit in ohio is just depressing. I just dont want people to disregard the deaths of animals such as chickens to bird flu, yes it very well could be. But look at the reports of people in the area - chickens literally dead overnight, foxes falling ill, countless fish floating down the river dead, and civillians reporting a chemical taste in the air. The plume looks post apocalyptic and it irritates when people say its just bird flu. Just lets the corporations responsible for this hide away while people debate why animals are dying whether things are safe etc. They want people to argue and there to be confusion because then they can hide behind it.",2023-02-14 05:21:49,Ohio,Anger,0.9997349381446838
That could be either from the derailment or bird flu... Should probably have them tested.,2023-02-14 20:27:35,Ohio,Fear,0.9902154207229614
